ticket_id,title,description,priority,status,category,department,requester,assignee,created_date,resolved_date,sla_target_hours,resolution_hours,sla_met,customer_satisfaction
TKT-000001,Enterprise-wide regional functionalities,"Mission care table argue country behavior.
Central up painting old four discuss. Than church place decision. Down agent upon mission resource imagine door.",High,Open,Phone,Operations,Ashley Gilbert,,2025-02-24 14:15:01,,8,,False,
TKT-000002,User-friendly transitional parallelism,"Often nice kitchen food tonight food.
Cause heart cover at air close source. Dream expect city hear arrive writer forward.",High,Pending,Software,Marketing,Hector Hatfield,Robert Miles,2025-04-15 14:06:52,,8,,False,
TKT-000003,Exclusive attitude-oriented framework,Sort material again it whatever central different. Answer way product special.,Low,Resolved,Access,IT,Preston Stewart,Katrina Rodriguez,2025-06-09 00:15:59,2025-06-11 05:45:36.481248,72,53.4937447910195,True,
TKT-000004,Centralized real-time Graphical User Interface,Deep speech factor author behavior. Treat teacher unit probably culture story at. Star lot free.,Low,Resolved,Email,Sales,Tricia Mercer,Jimmy Camacho,2025-03-27 17:11:47,2025-03-29 08:22:38.213879,72,39.180892744055456,True,
TKT-000005,Versatile dedicated hardware,Compare part training door. Kitchen impact could stock phone education plan. Box degree marriage form whose mother sort.,Low,In Progress,Software,HR,Jamie Adams,Jane Sanchez,2025-01-31 15:00:05,,72,,False,
TKT-000006,Open-architected 24/7 initiative,Strategy hard financial walk fast thank wait. Administration research property exist as democratic water. Generation establish option.,Critical,Pending,Hardware,Marketing,Amy Reed,Aimee Campos,2025-04-21 10:03:57,,4,,False,
TKT-000007,Reverse-engineered fault-tolerant time-frame,"Director always general perhaps throughout least.
Yard argue central art rich class generation participant. So everything finish ability.",Low,In Progress,Access,Operations,Courtney Rich,Paul Shields,2025-04-11 01:46:51,,72,,False,
TKT-000008,Integrated neutral migration,Station myself half condition image knowledge must yard. Evidence respond visit the white.,Medium,Closed,Email,Sales,Patricia Garcia,Joseph Hull,2025-04-03 13:34:55,2025-04-05 17:27:08.100957,24,51.87030582126638,False,4.0
TKT-000009,Pre-emptive explicit Internet solution,"Cut onto name soon main thus take. Material listen fall face.
Nice small other modern should say lose discover. Maintain reveal his. Point we travel computer area somebody.",High,Resolved,Software,HR,Randy Maxwell,Renee Hahn,2025-04-16 07:53:47,2025-04-16 09:14:43.409172,8,1.3490025477744805,True,
TKT-000010,Quality-focused 5thgeneration secured line,Either reach bag story story new establish. Raise society way. Character step ago six brother guess strategy course.,Low,In Progress,Security,HR,Mary Church,Denise Lee,2025-05-22 17:32:27,,72,,False,
TKT-000011,Multi-layered solution-oriented website,Radio doctor director trip start maybe item. Far morning small per I hope summer.,Low,In Progress,Phone,Sales,Jessica Pierce,Heather White,2025-03-22 07:40:51,,72,,False,
TKT-000012,De-engineered tangible implementation,"Pay peace member foreign former. Ever detail run. Quite message claim parent use manage.
May reduce audience drop blood yet one. Class stock protect.",High,In Progress,Software,IT,William Dalton,Anthony Wallace,2025-06-30 06:22:42,,8,,False,
TKT-000013,Customizable explicit parallelism,"Enough leader week resource none short he.
Act firm her stop common. At loss simply suffer do serious. Guess father feel enjoy catch usually today thing.",Low,Open,Hardware,Sales,John Norris,,2025-03-14 23:44:41,,72,,False,
TKT-000014,Virtual national product,"Speech list push run throughout her. Billion war response increase standard former each.
Board quality east create. Lot quickly my heart change.",Critical,In Progress,Access,HR,Kayla Hines,Veronica Martinez,2025-07-22 01:37:03,,4,,False,
TKT-000015,Intuitive client-driven workforce,On cold person line point school. Contain shoulder director low dinner campaign. Business provide however far discuss data. Brother nice act expect PM provide.,Low,In Progress,Access,Operations,Daniel Mcfarland,Joshua Ross,2025-04-17 21:09:15,,72,,False,
TKT-000016,Cross-platform user-facing circuit,"Authority name series future old serve in. Cup about expect source.
Baby pattern attorney.",High,Open,Printer,Sales,David Garcia,,2025-02-24 07:31:42,,8,,False,
TKT-000017,Organic real-time Local Area Network,"Wife series cost once travel outside buy discussion. School stand if political.
Physical strong this next language. Leader include attorney by player. Song really bit table.",Medium,In Progress,Network,Marketing,Brittney Pacheco,Timothy Sanchez,2025-04-25 23:10:08,,24,,False,
TKT-000018,User-friendly 4thgeneration algorithm,"There admit care election. Yet five maybe own. Conference wind list Mrs air avoid.
Night investment fly avoid.",Medium,In Progress,Network,IT,Peter Baldwin,Jeffrey Garcia,2025-02-12 02:52:14,,24,,False,
TKT-000019,Configurable cohesive task-force,Land reach idea involve language yourself when leg. Fast beat face hold that. Draw industry yes itself.,Medium,In Progress,Phone,Sales,Kristina Curtis,Lorraine Jackson,2025-04-17 03:12:17,,24,,False,
TKT-000020,Versatile 6thgeneration encryption,"Responsibility born recently short democratic bed human. Effect worry although.
Opportunity responsibility cultural else land memory. Event south tend clearly. Value against different late its.",High,Pending,Hardware,IT,Tiffany Cannon,Sara Dunn,2025-07-07 17:33:07,,8,,False,
TKT-000021,Synergized disintermediate open architecture,"Middle make yourself drive industry. Last picture student difference.
Hand both recently wife. Agency least power send exactly hot. Practice future population top fast letter.",Low,Resolved,Email,HR,Joseph Woods,Samantha Carroll,2025-02-22 08:00:16,2025-02-27 00:32:37.663301,72,112.53935091695769,False,
TKT-000022,Upgradable bottom-line hierarchy,"School include car. Expert term artist billion. Occur institution course significant.
Hour around describe official. North I natural gas country create especially.",High,Open,Software,Finance,William Deleon,,2025-06-04 00:27:28,,8,,False,
TKT-000023,Exclusive eco-centric service-desk,"Control family system. Heart piece seven old key as happen break. Tough stay spring everybody.
Sound military perhaps camera. Organization statement fast successful. Use fear even set.",High,Resolved,Software,IT,Ann Carter,Heather Brady,2025-06-03 22:26:05,2025-06-04 00:08:53.849643,8,1.7135693453929326,True,
TKT-000024,Profit-focused executive portal,Environment peace per public upon year tough. Nation you attorney identify read. Congress institution bad let interest.,Medium,Closed,Email,Finance,Joshua Johnston,Jennifer Allen,2025-04-25 09:37:19,2025-04-26 10:21:35.683937,24,24.737967760140364,False,5.0
TKT-000025,Organic incremental extranet,"Accept while physical. Yet show land some admit site employee.
Cold Democrat partner. Final forget piece production weight.
Yet will PM provide gun example. Approach consider language all.",High,Closed,Software,Operations,Rachael Allen,Kylie Hawkins,2025-02-11 15:06:46,2025-02-12 02:12:21.092273,8,11.093081186952837,False,5.0
TKT-000026,Object-based modular toolset,"Federal series price plan. Financial dark show get every. Green song agency report woman.
Language body play safe. Poor lose her almost large.",Low,In Progress,Access,Marketing,James Beck,Allison Harris,2025-01-23 02:49:30,,72,,False,
TKT-000027,Sharable zero tolerance info-mediaries,"Protect a activity action. Bar first quality character various.
Threat single out modern brother write. He good remember.
Key they whom enjoy statement. Back about through place. Treat section year.",Medium,Resolved,Software,Finance,Jesse Morgan,Spencer Graham,2025-02-07 08:44:04,2025-02-08 06:03:10.158738,24,21.318377427170372,True,
TKT-000028,Multi-channeled responsive initiative,Situation new condition else wind American. All president will dinner learn blue drive. Network per risk ability feeling item.,Low,Closed,Hardware,Marketing,Lisa Beasley MD,Kathryn Soto,2025-02-24 09:30:44,2025-02-27 09:58:36.388819,72,72.46455244961847,False,4.0
TKT-000029,Stand-alone responsive portal,"Plan staff end word interesting. Up organization compare so democratic of later.
Enjoy wish main memory know own. Color television especially seem land those any.",Low,In Progress,Access,Sales,Eric Zimmerman,Jerry Little,2025-07-07 09:23:01,,72,,False,
TKT-000030,Implemented leadingedge secured line,"Station rich actually which writer six. Head oil number respond center television.
Scene large than unit bill. Game bill rest.",Low,Resolved,Access,Marketing,James Cochran,John Rice,2025-02-12 01:36:04,2025-02-13 15:58:11.839988,72,38.36884444105171,True,
TKT-000031,Quality-focused asymmetric utilization,"Whole them light rest general. South benefit behavior else seven rate open. Former box if bad prove no. Debate north Mr arm instead article.
Case sure edge reveal get.",Low,Open,Security,Operations,Rebecca White,,2025-04-30 17:20:45,,72,,False,
TKT-000032,User-centric tangible conglomeration,"Air image front experience. Man rather defense history science.
Thing ground southern list network huge research guess. Financial may dark and real from than. And military hope program senior PM my.",Low,Closed,Phone,Sales,Anthony Hawkins,Gregory Mcgee,2025-06-24 07:42:37,2025-06-27 07:30:42.779988,72,71.80160555217896,True,5.0
TKT-000033,Visionary logistical interface,Foreign reach thing trouble dream car. Than section get use Republican within. Television relate red break decide take bit.,Low,In Progress,Security,IT,Wyatt Fletcher,Alexis Williams,2025-05-14 13:18:55,,72,,False,
TKT-000034,Front-line content-based function,"Beautiful line win and. Old four growth training listen baby cost.
Special performance letter of. Huge her property great win.",Medium,Open,Phone,HR,Tommy Lee,,2025-02-22 23:30:03,,24,,False,
TKT-000035,Reverse-engineered non-volatile service-desk,"Professor price not able worry carry contain. Director wide be dream find out.
Protect situation think security forget relate. Serious often southern. View interview sometimes put goal safe weight.",High,Closed,Phone,IT,Juan Moore,Carrie Davidson DVM,2025-05-26 09:37:34,2025-05-26 17:11:32.079470,8,7.5661331862044925,True,5.0
TKT-000036,Implemented heuristic service-desk,Campaign process scientist apply. Easy she realize early standard. Finally light low field open option.,Medium,Resolved,Email,Marketing,Justin Hartman,Wendy Johnson,2025-07-08 12:32:11,2025-07-08 23:42:29.389924,24,11.171774978799155,True,
TKT-000037,Diverse tangible portal,"Crime risk foreign.
Small for beyond might system.
Eye instead either foot. War season budget provide. Compare agency physical heavy me again shoulder customer.",Low,Open,Software,IT,Travis Weaver,,2025-02-22 03:09:59,,72,,False,
TKT-000038,Intuitive cohesive flexibility,Generation young so teacher significant song. President foot into report current international edge. Indeed area assume happen.,Medium,Resolved,Email,Marketing,Brent Ross,Zachary Cabrera,2025-04-04 06:07:12,2025-04-04 17:00:46.422703,24,10.89289519539739,True,
TKT-000039,Re-contextualized 24/7 protocol,Born ten catch suggest house majority. Course finish order everybody share main. Tend low green few beautiful hour.,Low,In Progress,Phone,Operations,Alexander Thompson,Bradley Gonzalez,2025-06-08 05:02:38,,72,,False,
TKT-000040,Fundamental needs-based hardware,"So network case receive training collection. Save lay air card. Kid determine morning else everyone.
Entire adult direction attack box example. Beyond loss choice office.",Medium,Resolved,Security,Sales,Walter Hendricks,Kelly Thornton,2025-03-30 06:47:46,2025-03-31 00:54:48.969357,24,18.117491488018768,True,
TKT-000041,Function-based secondary paradigm,Democrat radio find agent offer probably. Bad exist section claim these white laugh. Success executive institution simply send despite whether.,Low,Closed,Software,HR,Briana Parks,William Collier,2025-04-12 21:52:28,2025-04-14 11:40:25.550407,72,37.799319557551655,True,3.0
TKT-000042,De-engineered client-server moratorium,"Manager smile part sit. Which office cut turn someone.
Hold some she. Bill you include cultural. From together day care position shake action small.",Low,Resolved,Security,HR,Rebecca Burke,Austin Keller,2025-02-20 19:10:32,2025-02-21 11:48:53.182958,72,16.639217488312205,True,
TKT-000043,Operative neutral installation,Rich series pick set can. Conference according minute lead act.,High,In Progress,Software,Operations,Suzanne Long,Jamie Johnson,2025-04-06 10:30:30,,8,,False,
TKT-000044,Fundamental systematic matrices,"Let many learn establish important. Product order she dream voice expert.
Perform guy performance lead worker white process arrive. Able seem according drug consider partner.",High,Closed,Access,IT,Jeffrey Williams,Pamela Garcia,2025-07-22 23:45:32,2025-07-23 07:24:03.702963,8,7.642139711884997,True,4.0
TKT-000045,Seamless analyzing knowledgebase,"Soon late cover ask experience. Clearly sure same social security.
Sometimes skill reality. Tough local so. Detail life draw either group child. Land thus try much foot.",Medium,Closed,Security,Legal,Timothy Harris,Derek Brown,2025-04-25 17:09:36,2025-04-27 01:08:56.470467,24,31.989019574098812,False,4.0
TKT-000046,Total 24/7 matrix,"Weight she rather serious heart. Commercial away society recognize improve.
Cultural money eye choose whole eight. Event provide eight however project professional general.",Low,Resolved,Network,Operations,Crystal Gonzales,Robert Smith PhD,2025-04-08 06:26:50,2025-04-09 12:40:23.968407,72,30.22610233522581,True,
TKT-000047,Extended homogeneous structure,Indeed series scientist decide this. Team feeling again might give news surface. Continue maybe pick career watch.,High,In Progress,Software,HR,Kristine Rosario,Susan Torres,2025-03-03 06:48:10,,8,,False,
TKT-000048,Automated content-based application,Detail system point financial worry purpose put easy. Mission girl situation until hour history address Democrat. Citizen own able ago common rest.,Medium,Closed,Software,HR,Alex Smith,Luis Peterson,2025-03-22 15:31:57,2025-03-23 09:40:18.607743,24,18.139335484200796,True,1.0
TKT-000049,Profit-focused system-worthy open architecture,"Age enough TV market detail need. Paper law week recent source head region continue. Recently region audience mother.
Lot page husband quickly. Method available say smile just.",Low,Resolved,Security,IT,Gabrielle Smith DDS,Andrea Williams,2025-04-21 00:46:46,2025-04-23 13:57:57.651393,72,61.18656983128598,True,
TKT-000050,Synergized secondary core,Himself order throughout decade mother condition girl free. Different law girl everyone easy key. Along guy serious say. These country fall stock floor everything.,High,Open,Network,Finance,Terry Weaver,,2025-05-15 08:47:04,,8,,False,
TKT-000051,Persistent 5thgeneration contingency,"We provide hand civil scientist. Each almost early support important. Color environment second lot ever manage. Nice tax anything easy.
Red or mean account old. He chair score power.",Medium,In Progress,Phone,Finance,Jeffrey Garcia,Dr. David Cole,2025-07-12 11:39:46,,24,,False,
TKT-000052,Cross-group explicit intranet,"Society office act agreement upon here. Oil risk product realize sort.
Remember popular theory film.",High,Resolved,Network,Sales,William Hansen,Savannah Rosario,2025-04-13 23:33:55,2025-04-14 09:36:37.517908,8,10.045143863247123,False,
TKT-000053,De-engineered bandwidth-monitored info-mediaries,Follow three enough single lot yet into. Small threat parent there look wife risk. Vote fly would everyone since brother. Person professional tough artist happen time enter.,Low,Closed,Network,Sales,Robert Leon,James Reynolds,2025-05-06 03:50:28,2025-05-07 20:44:07.698533,72,40.89436070347656,True,4.0
TKT-000054,Configurable zero-defect installation,Difficult behavior wish watch move he order. Person control arrive section radio with. Yard against dinner Republican wonder stuff industry speak.,Low,Resolved,Security,IT,Wayne Miller,Meredith Daniels,2025-01-24 07:14:38,2025-01-25 15:31:46.222602,72,32.28561738956809,True,
TKT-000055,Vision-oriented secondary concept,"Box wonder pattern. Life newspaper sign anything.
Amount stuff adult matter religious west. Window field way help figure word attorney animal.",Critical,Resolved,Network,Finance,Dr. Julie White DVM,Jeffrey Williams,2025-04-10 01:08:03,2025-04-10 07:34:01.063655,4,6.4327954597995465,False,
TKT-000056,Open-source transitional collaboration,"Improve guy drive. Avoid why series.
Since will explain somebody mean. Positive brother likely yard others find how.",Low,Closed,Printer,Sales,Gabrielle Sandoval,Rodney Long,2025-04-15 06:51:47,2025-04-17 09:54:28.169290,72,51.044769247216635,True,3.0
TKT-000057,Secured context-sensitive product,"Sound character add test page specific put. Public letter how wish night.
Sound pass determine follow agency either. Act science direction hand book article not can.",Medium,Open,Hardware,HR,Allison Wilkinson,,2025-03-08 05:45:31,,24,,False,
TKT-000058,Polarized mobile collaboration,"Spring two technology every admit head phone feeling.
Various pressure opportunity source hundred begin wrong executive. Result piece white sit nation generation. Inside old well event.",Low,In Progress,Access,HR,Eric Carey,Jesse Byrd,2025-03-12 08:29:47,,72,,False,
TKT-000059,Synergized directional open system,"Section dinner reduce clearly. Expert state director girl. Miss often most side business too.
Require report they history value. Green yard party win.
Care out whom however audience not.",Medium,Closed,Hardware,HR,Margaret Anderson,Benjamin Collins,2025-06-25 02:50:18,2025-06-26 01:49:46.156971,24,22.991154714203354,True,2.0
TKT-000060,Customer-focused grid-enabled Internet solution,"Help these couple.
Risk student style shoulder medical news body either. Road oil history reach person.
Head really much job effort wish. Sport religious culture back raise.",High,Open,Access,Marketing,Charles Johnson,,2025-04-05 12:14:54,,8,,False,
TKT-000061,Networked actuating standardization,"Hear organization space check. Experience herself election ability. Loss technology international break term fear those.
Close forget public. More guy kitchen especially off require carry music.",Low,Resolved,Software,Marketing,Carol Armstrong,Lauren Spencer,2025-06-02 02:29:49,2025-06-04 17:49:54.430798,72,63.33484188824462,True,
TKT-000062,Versatile intangible encoding,"Sport movie sing stand part inside. Modern short range our walk either order.
On threat none operation much. Candidate beat type actually seem. Including high before tell.",Low,Open,Access,Finance,Abigail Zuniga,,2025-05-25 08:45:33,,72,,False,
TKT-000063,Quality-focused scalable encoding,"Provide attack lose kind speak story trip. Finish value including note with. Positive member discussion interview.
Population edge senior year. Talk statement behavior defense.",Medium,Resolved,Software,HR,Amy Lynch MD,Christina Ferguson,2025-04-04 09:09:37,2025-04-04 16:20:18.526781,24,7.178201883638815,True,
TKT-000064,User-friendly encompassing model,"Less attorney front level especially language send. Congress appear start significant population. Many begin skin little care need.
Figure notice left story. Time beat pressure performance part.",Low,Resolved,Software,Finance,Kim Shelton,Derek Diaz,2025-03-27 06:57:33,2025-03-27 16:25:28.926980,72,9.465535272091834,True,
TKT-000065,Enhanced interactive budgetary management,"Land whatever trial because quite year real. Unit girl although.
Radio physical American everything toward music walk foreign. Maybe garden month learn image question general success.",High,Resolved,Email,Marketing,Diane Guerrero,Ronald Conner,2025-06-19 04:42:33,2025-06-19 12:44:35.485061,8,8.034023627962872,False,
TKT-000066,Reverse-engineered high-level algorithm,Surface girl herself area these month financial. Answer campaign floor morning give candidate remember paper. Style rich provide around movement every.,Medium,Resolved,Software,Operations,Kimberly Weaver,Jessica Lee,2025-01-30 19:32:07,2025-01-31 13:50:39.692672,24,18.309081297737148,True,
TKT-000067,Future-proofed high-level support,Phone whole specific stock hard. Pm eight television wife value several interest. Involve tough among movement set side town enjoy.,Medium,Open,Hardware,IT,Michael Kennedy,,2025-04-12 05:10:52,,24,,False,
TKT-000068,Balanced clear-thinking framework,"Strategy attorney positive read. Material hair concern clear outside great notice.
However cultural field recognize wear. Manager attack have one.",High,Closed,Hardware,Marketing,Maria Chambers,Diane Thomas,2025-05-07 21:53:08,2025-05-08 08:16:28.012120,8,10.388892255636554,False,4.0
TKT-000069,Streamlined tangible firmware,Believe benefit land wife simple soon. Huge far save office become. Series audience need sit often question.,Low,Closed,Software,Finance,Stephen Jackson,Aaron Mckinney,2025-02-27 02:51:37,2025-03-01 21:31:15.387266,72,66.66066312935148,True,3.0
TKT-000070,Profit-focused scalable framework,"Seat Mr because stage data language add soon. Behavior wait may office now. Class believe board our mouth financial government spring.
On Democrat walk reduce spend. Mouth none nothing happen.",Medium,In Progress,Software,Finance,Samuel Lee,Robert Browning,2025-02-03 21:48:45,,24,,False,
TKT-000071,Cross-group methodical approach,"Blue consider family business.
Candidate chair step executive individual address eight. Relationship most woman south upon history across throw.",Medium,Resolved,Security,IT,Cheryl Martinez,Ariana Wong DDS,2025-02-22 03:40:08,2025-02-22 09:31:31.101360,24,5.856417044438032,True,
TKT-000072,Cross-group multimedia array,Simple one then attorney significant nature action. Drive not fire again soon economy. Perhaps Democrat item share investment mother.,Low,Closed,Printer,Marketing,Roger Bates,Javier Reed,2025-04-09 02:11:58,2025-04-11 10:32:27.545975,72,56.34154054866122,True,1.0
TKT-000073,Visionary multi-tasking analyzer,"Move who car teach if born send. Point Democrat win these. Begin indicate election will reflect article.
Animal order significant live model claim. Cup herself effort.",Low,Resolved,Security,HR,Steven Cook,Diane Smith,2025-02-27 22:46:19,2025-02-28 07:21:48.465026,72,8.59151806285088,True,
TKT-000074,Re-engineered 24/7 open architecture,Make long may by. Thank government woman effort feeling consider. Suggest environment teach possible.,Medium,In Progress,Network,Finance,Andrew Ayers,Ryan Ruiz,2025-07-17 07:25:54,,24,,False,
TKT-000075,Synergized client-driven paradigm,"Catch threat pick. Upon change stuff relate imagine.
Part run something a standard. Blue service anything difference seven throw blue. Near discussion glass seven pretty book structure.",Low,Closed,Printer,HR,Glenn Trujillo,Brianna Dawson,2025-07-19 15:07:53,2025-07-22 23:19:23.874008,72,80.19190944662117,False,4.0
TKT-000076,Inverse maximized portal,"Pass fly his reach point rise president.
Family coach each media deep. Tree manager per police customer age.
Into itself author hit although.",Medium,Open,Network,Sales,Mark Garcia,,2025-06-12 22:57:14,,24,,False,
TKT-000077,Profound regional productivity,Recently natural outside bad blue technology media money. Upon happy hear government floor decide. End outside computer drop.,High,Closed,Network,IT,Joyce Anderson,Rebecca Wells,2025-07-05 03:54:13,2025-07-05 11:06:23.327753,8,7.2028688201857305,True,2.0
TKT-000078,Implemented upward-trending success,Not change reveal. Form picture onto member TV care. Approach service organization school. Store coach new ground window unit either put.,Medium,In Progress,Hardware,HR,Krista Smith,William Sparks,2025-03-25 17:06:02,,24,,False,
TKT-000079,Virtual stable parallelism,"Development hard away age. Western hard third capital. Visit right some writer career right four. Surface best white wish trouble may.
Impact box election action. Hard Mrs mention.",Low,Resolved,Access,IT,Kayla Estrada,April Cruz,2025-01-22 21:59:15,2025-01-26 00:32:02.990712,72,74.54666408667144,False,
TKT-000080,Seamless composite firmware,"Example ahead stock your trip section sing. Specific little water successful. Professor artist building democratic.
Skin yourself democratic side. There exactly protect born large.",High,Resolved,Access,HR,Rose Kirby,Jessica Williams,2025-05-06 11:43:41,2025-05-06 21:10:56.699454,8,9.454360959536361,False,
TKT-000081,Vision-oriented hybrid Local Area Network,"Their hundred argue student rich its. Recently I cultural result.
Dinner fish second attention. Present much director network.",Low,Resolved,Access,Sales,Susan Huerta,Molly May,2025-02-13 13:42:43,2025-02-15 06:50:26.354317,72,41.128709532590534,True,
TKT-000082,Distributed regional contingency,Name decision have. Doctor impact prevent size side.,Medium,Open,Network,IT,Shannon Acosta,,2025-04-13 00:46:58,,24,,False,
TKT-000083,Assimilated multi-tasking software,"Current hot level century main. Beyond shoulder citizen minute.
Off wait tree dog mother single available. Yourself seem above to strong. Theory kid those so water go.",Medium,Resolved,Software,HR,Nathan Baldwin,Teresa Roth,2025-07-08 18:27:24,2025-07-09 14:05:45.985037,24,19.639440287946503,True,
TKT-000084,Assimilated interactive application,"Follow tree firm state cut. New economy task however religious.
Back data bed free society other bad. It class boy month forward interview day different. There direction during owner later house.",High,Open,Access,Sales,Mark Allen,,2025-04-11 02:56:48,,8,,False,
