ticket_id,title,description,priority,status,category,department,requester,assignee,created_date,resolved_date,sla_target_hours,resolution_hours,sla_met,customer_satisfaction
TKT-000673,Intuitive 24hour collaboration,"Find arrive hotel president. Yeah course woman responsibility argue. Fly always natural national subject.
Military ability charge pick partner. Test girl pressure join I.",Low,In Progress,Printer,Legal,Trevor Hudson,Karen Jackson,2025-03-24 14:32:51,,72,,False,
TKT-000674,Multi-layered disintermediate budgetary management,"Past place loss arrive already medical break. Picture they this trip subject state.
Health have item property win. Dog son time office theory. Value spring effect they fund focus.",Medium,In Progress,Hardware,IT,Amanda Serrano,Zachary Scott,2025-05-17 01:29:44,,24,,False,
TKT-000675,Total holistic hub,"Team floor serve benefit about appear.
Environmental usually like. Support question result. Suddenly voice level easy.",High,Resolved,Access,Operations,Deanna Thomas,Sarah Davis,2025-07-09 17:59:08,2025-07-10 03:14:22.072528,8,9.253909035605055,False,
TKT-000676,Persevering attitude-oriented capacity,Often not research growth old far. Couple good huge individual. Information her throw car.,Low,Closed,Security,Operations,Danielle Moss,James Petersen,2025-05-07 19:46:39,2025-05-11 15:09:39.668093,72,91.38351891471072,False,2.0
TKT-000677,Polarized context-sensitive orchestration,"Part civil action usually camera. With past view trade short station success.
Kind dream available such goal. Girl seem husband discuss.",Low,Resolved,Security,Sales,Timothy Huff,Megan Lewis,2025-04-22 15:51:29,2025-04-23 08:49:17.605547,72,16.963501540920134,True,
TKT-000678,Balanced analyzing contingency,Bed night somebody feel two. System herself chair while next matter television.,Low,Pending,Software,HR,Mary Harvey,Douglas Wright,2025-01-26 04:47:43,,72,,False,
TKT-000679,Programmable next generation matrices,Statement so help product behavior. Scene research citizen various six meet.,Medium,In Progress,Network,IT,Amber Johnson,Sara Glenn,2025-05-20 10:45:49,,24,,False,
TKT-000680,Customer-focused directional knowledge user,"Fish show issue thousand low medical experience. These leave far all vote sport happy imagine. These just would what young others.
Great site party at quality. Memory happy threat always voice.",High,Open,Access,IT,Miranda Brown,,2025-04-15 14:30:51,,8,,False,
TKT-000681,Optimized impactful methodology,My study daughter senior. Woman alone economic second particular recently establish kitchen. American can though culture dinner church.,Medium,In Progress,Hardware,Marketing,Maria Singh,Traci Green,2025-05-09 10:21:11,,24,,False,
TKT-000682,Organic needs-based hub,Pass admit against tough much tax summer. Commercial citizen think likely put provide.,Low,In Progress,Hardware,IT,Brooke Stewart,Danielle Gonzalez,2025-02-26 21:29:47,,72,,False,
TKT-000683,Re-contextualized content-based array,Born among buy source. Laugh ready forward. Drop billion start oil friend dark. These likely industry upon customer common miss.,Low,Resolved,Software,IT,Austin Price,Jaime Ford,2025-06-12 21:20:08,2025-06-13 10:57:26.703780,72,13.621862161186236,True,
TKT-000684,Switchable didactic solution,Tax eye heavy choice me such especially why. Thousand military my interest expert beyond. Country record suggest century individual.,Medium,In Progress,Software,Operations,Andre Higgins,David Robinson,2025-06-04 10:52:24,,24,,False,
TKT-000685,Cloned maximized monitoring,Actually court late five base. Theory Mr remember into. Rate international other value.,High,Open,Hardware,Sales,Krista Orr,,2025-06-28 16:48:36,,8,,False,
TKT-000686,Persevering motivating circuit,"Can paper research cost point over probably mind. This piece a various.
Become throw along science nothing. Cup treatment analysis lead garden.",High,Closed,Network,Operations,James Byrd,Amanda Graham,2025-06-17 01:49:10,2025-06-17 13:22:00.677584,8,11.547410439959416,False,4.0
TKT-000687,Function-based multi-tasking archive,"Interview owner continue stock ball federal space.
Education PM account candidate must. Wrong foot mean strategy else trouble pass.
Hotel job wonder your. Word doctor space night history.",Low,Resolved,Printer,HR,Peter Hart,Samuel Harrison,2025-03-14 05:39:34,2025-03-15 05:34:30.139043,72,23.915594178616566,True,
TKT-000688,Vision-oriented regional groupware,"Treatment range positive shoulder. Of majority firm nation base.
Tree away economic know. Side thank under series before car.",Low,Open,Hardware,IT,Walter Harrison,,2025-06-15 14:52:51,,72,,False,
TKT-000689,Pre-emptive client-driven productivity,"Improve social series. Clear modern when third. Officer form pretty. Owner model song stuff direction.
Movie south rule. Remember community class executive training. Very almost reach population.",Medium,Resolved,Security,HR,Joshua Arias,Jacob Ferrell,2025-03-03 07:55:10,2025-03-04 15:22:47.820418,24,31.460505671566086,False,
TKT-000690,Cross-group 24/7 contingency,"Professional too key remember hard along least. History beat ready trip baby fine.
Note tend whom physical. End action already dark central can operation executive. Ready newspaper practice build.",Medium,In Progress,Email,HR,Amanda Harrison,David Rocha,2025-04-14 16:57:33,,24,,False,
TKT-000691,Multi-tiered fresh-thinking challenge,"Perhaps marriage positive. Television talk news down popular.
Investment ready parent a third again mean. Data state tell ability voice writer party old. He difficult girl employee window anyone.",Low,In Progress,Hardware,IT,Tyler George,Richard Johnson,2025-05-09 01:30:23,,72,,False,
TKT-000692,Polarized optimizing approach,"Film piece career real budget purpose piece information. Tell act until course actually cause.
Religious news cup. Store decide or society admit.",High,Resolved,Software,Sales,Brian Flores,Elizabeth Hays,2025-03-14 11:58:22,2025-03-14 21:17:52.782058,8,9.325217238463242,False,
TKT-000693,Exclusive even-keeled secured line,Director perform we international. Cup resource green consumer yeah situation or. Major over develop before Republican lose step.,Low,Pending,Access,Finance,Christopher Becker,John Hernandez,2025-03-08 10:36:13,,72,,False,
TKT-000694,User-centric web-enabled array,"Say attack should build less. Up direction project design trial market.
Myself affect coach wrong lawyer myself move good. Long article think condition audience to. Pattern set avoid herself sister.",Medium,Resolved,Software,Marketing,Crystal Garcia,Michael Perez,2025-01-31 18:26:13,2025-02-01 10:04:34.683796,24,15.63935660995232,True,
TKT-000695,Versatile executive customer loyalty,"Serious few film marriage ready decision. Chair impact no of. New lead office our lawyer.
Bag personal contain. Away last once responsibility star alone. Country parent recognize century throughout.",High,In Progress,Network,IT,Katherine Mcclain,Alexander French,2025-07-03 15:52:03,,8,,False,
TKT-000696,Decentralized responsive access,Sense town else by make. Manager company media back pretty something safe notice. Around card throw us there billion collection decision. Though later hospital.,High,In Progress,Access,HR,Jason Dennis,Alexis Hernandez,2025-06-15 21:48:09,,8,,False,
TKT-000697,Function-based next generation project,"Doctor avoid action we audience series Republican.
These his rate recognize. Where effort carry within free artist. A common week price low charge.",Low,In Progress,Email,IT,Cole Meyer,Sarah Morgan,2025-06-20 13:54:19,,72,,False,
TKT-000698,Upgradable value-added array,Believe rather design eight hit point every. Successful body discuss. Necessary important color place growth soon.,Low,Resolved,Software,Finance,Lisa Herrera,Jonathan Gray,2025-06-19 17:33:36,2025-06-20 22:38:52.219301,72,29.087838694718474,True,
TKT-000699,Right-sized responsive functionalities,"Enough cost cost someone yet now. Past factor green prepare enough.
Itself tell best from middle stand go. Between right example parent.",Low,In Progress,Hardware,IT,Karen Harding,Tracy Bishop,2025-05-02 16:01:16,,72,,False,
TKT-000700,Devolved empowering budgetary management,Know visit smile staff week. Use task nor concern. Least success yeah. Computer kind month degree success four.,Low,Open,Software,Marketing,Chad Sanchez,,2025-07-11 23:45:07,,72,,False,
TKT-000701,Versatile actuating Graphic Interface,"Care face third term growth rich. Him fear attack population.
Wonder various experience wide may cause. Ago rich law trouble economic once eye. When as series result.",Low,Resolved,Network,Operations,Kristin Nelson,Ricky Knapp,2025-02-16 17:35:03,2025-02-20 03:18:38.172656,72,81.72643684885459,False,
TKT-000702,Up-sized interactive focus group,"Tv effect physical do fall citizen. Ahead state citizen media from increase father do. Serious organization thank part job.
Main trouble chance fight. Foot kind nothing.",Low,In Progress,Software,Finance,Veronica Cummings,Karen Kelly,2025-07-17 03:34:23,,72,,False,
TKT-000703,Exclusive zero-defect monitoring,"Rich special some could science near. Year seek join hand let major else. Win learn man risk add expect.
Guy side specific particular not. Finish detail land cause knowledge.",High,Open,Phone,IT,Julie Jackson,,2025-02-02 19:38:41,,8,,False,
TKT-000704,Reverse-engineered optimal throughput,"Executive rather challenge themselves gun day thus section. Hard contain go hair lot phone.
Nothing cost cover his magazine establish film. Area manage dog affect realize.",Medium,Open,Software,HR,Stacy Mendez,,2025-05-09 01:10:14,,24,,False,
TKT-000705,Reduced executive secured line,"Team special project condition staff senior American loss.
Author understand door ahead suffer policy town.
Somebody west space defense.",Medium,Open,Access,Marketing,Jason Clark,,2025-03-09 23:10:31,,24,,False,
TKT-000706,Decentralized empowering support,"Action purpose really.
Dog easy key by wish. Condition small hope less leg traditional hotel.
Glass music several staff hope. Recognize way treat rather blood recent national.",Medium,Closed,Security,Sales,Brandi Allen,Nicholas Johns,2025-02-15 20:05:41,2025-02-16 05:09:37.263289,24,9.065628691400768,True,3.0
TKT-000707,Public-key composite product,"Car road hold defense. Pick office growth voice wide under.
Hear election far fact civil decide. Instead back sort agreement drive carry. Level world practice catch.",Low,In Progress,Software,Finance,Kelly Vasquez,Caitlin Nichols,2025-02-06 13:06:57,,72,,False,
TKT-000708,Customer-focused human-resource infrastructure,"Tax growth likely usually wear.
Paper phone care goal lawyer join one. Great would future loss travel.
Feeling such either wish city visit. Voice sign southern early kitchen ago.",Medium,Resolved,Hardware,Marketing,Samantha Roy,Rebecca Taylor,2025-05-27 01:55:30,2025-05-27 15:27:33.705441,24,13.534362622415461,True,
TKT-000709,Multi-channeled client-server success,Same and serious baby sign side play. Goal pattern fly trip. Someone arrive visit our major teacher value hit.,Medium,Pending,Access,Sales,Erika Hanson,Paula Young,2025-04-29 13:29:30,,24,,False,
TKT-000710,Vision-oriented even-keeled budgetary management,"Maintain very see. Billion red name describe.
Imagine option wide question box society important. Less deal agent live. Join everything career to necessary.",Low,Open,Software,Marketing,Michael Forbes,,2025-01-23 02:52:59,,72,,False,
TKT-000711,Proactive demand-driven utilization,Red reveal I. Which interview woman fear. Standard likely early record population step happen.,High,In Progress,Hardware,Legal,Ryan Velasquez,Seth Wu,2025-05-27 09:52:11,,8,,False,
TKT-000712,Adaptive full-range Local Area Network,"Name one society make mention. Name range drop bill although none wide.
Party religious science defense could admit direction likely.",High,Resolved,Email,Operations,Grace Holland,Sharon Stone,2025-05-26 10:08:15,2025-05-26 21:11:47.473964,8,11.059020545609407,False,
TKT-000713,Open-architected systematic installation,"Water simply fear. International shoulder behind put our. Along dinner environmental maybe. Cost item town actually.
Organization improve none kid coach style fine quickly.",Medium,Resolved,Network,Finance,Nicole Singleton,Benjamin Robles,2025-01-31 04:06:10,2025-01-31 22:38:29.656334,24,18.538793426122663,True,
TKT-000714,Secured incremental framework,Do tell me doctor. It key with rock trade movement become. Soon seat lot others general challenge although.,Low,In Progress,Printer,Operations,Adam Dillon,John Williams,2025-07-03 08:13:41,,72,,False,
TKT-000715,Automated zero-defect system engine,"Create central lot tree move have. Gas scientist drug. Serve seek seem rise voice.
Every choice help these brother above. Throw sing community.",Low,Resolved,Network,Operations,George Williams,Melissa Reyes,2025-04-25 01:44:10,2025-04-28 01:01:00.377250,72,71.28066034721662,True,
TKT-000716,Open-architected value-added toolset,Until follow total many institution fear. Dream explain pass do mind owner floor. Say air where act. Court at call such almost.,Medium,Open,Access,IT,Elizabeth Brown,,2025-03-25 11:40:52,,24,,False,
TKT-000717,Customer-focused analyzing matrices,"Letter party practice experience give test. Tax everyone organization live plant senior.
Turn model then case. Force price country.",Low,Resolved,Hardware,HR,Joshua Smith,Ryan Miller,2025-05-20 11:00:26,2025-05-21 08:02:03.914976,72,21.027198604512392,True,
TKT-000718,Proactive encompassing architecture,Room team experience college. Foreign your another increase court those letter happen.,Medium,Closed,Hardware,Finance,Lisa Ramos,Carolyn Cannon,2025-06-27 19:29:21,2025-06-29 02:10:54.608857,24,30.692669127066928,False,5.0
TKT-000719,Cloned methodical algorithm,"Set notice study choice. Ability ahead alone economy program. Send room ask strategy suggest trip.
Year very law. Once clearly war trial himself. Arm career experience make suddenly watch water.",High,Resolved,Security,Operations,Alan Harrison,Denise Marks,2025-02-16 10:56:10,2025-02-16 16:07:25.654998,8,5.187681943985486,True,
TKT-000720,Multi-channeled content-based software,"Wind yet tax employee American many. Campaign last southern poor trial during.
Wall study and trial fish those. Seek yet clear machine appear act economy.",Critical,In Progress,Software,Marketing,Nicole Brown,Nicholas Lang,2025-05-23 13:45:01,,4,,False,
TKT-000721,Mandatory discrete success,Care night because picture tree camera life security. Three focus agreement without. Now pull system nation sign.,High,Open,Email,Operations,Brittany Reed,,2025-04-13 15:30:24,,8,,False,
TKT-000722,Function-based fault-tolerant framework,"Heart race able learn prepare. Southern chance manager guess. Series little hotel.
Language stay change us. Week election capital music service. Create writer state Congress.",Low,Resolved,Network,Marketing,Stephen Simmons,Jeremiah Vega,2025-02-01 07:19:00,2025-02-04 06:38:26.484446,72,71.32402345717252,True,
TKT-000723,Polarized 5thgeneration contingency,Without ago other strategy offer. Loss president current thing it. Need stop guy agreement market.,High,Resolved,Security,Finance,John Jones,Martha Charles,2025-04-20 14:11:46,2025-04-20 21:12:25.249629,8,7.010902674616366,True,
TKT-000724,Proactive mission-critical product,Page see some put young. Source town street idea certainly. Face third single.,High,Closed,Email,IT,Nathan Anderson,Gary Benitez,2025-03-09 19:13:32,2025-03-09 22:08:07.525483,8,2.9098681896722307,True,5.0
TKT-000725,Upgradable 24hour alliance,"Wear argue watch music.
Lawyer glass agreement economy would some. Different according street wish want development produce. Here entire deal pass turn feeling foreign.",Low,Resolved,Software,Marketing,Kevin Douglas,Billy Lopez,2025-04-14 10:32:29,2025-04-17 06:34:14.174465,72,68.02921512926481,True,
TKT-000726,Secured composite productivity,Central series thus line rise most chair wear. Order thank movie push. Lawyer account reality south how certain.,High,In Progress,Access,Marketing,Robert Dunn,Stephen Morgan,2025-07-05 17:02:24,,8,,False,
TKT-000727,Synchronized regional circuit,"Human develop short true life son four. Nice tend prove political vote quite let. Natural beyond total hit himself.
Gas push stay will. Consider before look face standard.",Low,In Progress,Access,HR,Monique Houston,Jennifer Smith,2025-05-26 16:46:59,,72,,False,
TKT-000728,Balanced transitional product,Something but they clear list fast. Human should catch camera. To so focus art computer miss. Member address huge let win support.,Low,Closed,Software,IT,Jessica Hunter,Jeffrey Cobb,2025-04-24 23:18:30,2025-04-28 14:34:01.454519,72,87.25873736640358,False,4.0
TKT-000729,Stand-alone holistic firmware,"Good almost short sister red item break. World course sport threat.
Popular main star my now nature far. Policy society newspaper per economic. Far suddenly trouble build box event.",Low,In Progress,Network,Operations,Christopher Garcia,Mary Taylor,2025-06-18 22:55:12,,72,,False,
TKT-000730,Horizontal uniform superstructure,"Live doctor get worker board ready mouth that. Measure able something thousand we.
Dark piece unit measure church control. Will both quite yourself threat check main.",Low,Resolved,Email,IT,Tim Luna,Megan Boyer,2025-05-22 02:33:40,2025-05-22 18:28:40.962995,72,15.916934165227481,True,
TKT-000731,Quality-focused 3rdgeneration matrix,Clearly on central possible. Eight brother myself government cold. Change behavior room design evidence.,High,Closed,Software,Finance,Shelia Diaz,Alexandra Wells,2025-04-20 04:24:32,2025-04-20 16:15:05.115326,8,11.842532035029524,False,2.0
TKT-000732,Realigned cohesive database,"Account school probably soldier.
Environmental contain he stock trial. Character impact clearly which fill point.",Medium,Closed,Email,IT,Jamie Short,Karen Torres,2025-06-27 05:48:12,2025-06-27 14:42:53.569975,24,8.911547215295059,True,3.0
TKT-000733,Balanced asymmetric challenge,Water benefit need run hold born. Machine nice home analysis. Do around fly audience include spring suggest.,Medium,Open,Software,Operations,Jim Schmidt,,2025-03-04 17:41:04,,24,,False,
TKT-000734,User-centric eco-centric solution,"Painting research industry simply push talk away. Relate billion once maybe realize clearly. Writer any grow.
Kid face nation data themselves just.",Low,Resolved,Phone,IT,Veronica Williams,Cassandra Cruz,2025-05-04 19:53:51,2025-05-06 04:24:43.319094,72,32.514533081553665,True,
TKT-000735,Programmable object-oriented initiative,"Human property again buy. Want least into.
Ahead exist common own such production probably. Together month some let both. Experience very statement school everybody day.",High,Resolved,Phone,Sales,Tom Carter,Miranda Morrison,2025-02-22 11:44:11,2025-02-22 17:14:45.585916,8,5.509607198954153,True,
TKT-000736,Secured demand-driven productivity,"Rule serve could easy camera check. Someone peace right hair garden for free Republican.
Foreign rule response hair. Local sport in next.",Medium,Resolved,Printer,IT,Michelle Novak,Joshua Stewart,2025-06-02 01:25:33,2025-06-03 01:03:46.256628,24,23.637015730082013,True,
TKT-000737,Mandatory zero tolerance open architecture,"Everybody leave reveal hit. Member trip here ability glass foot involve.
Six hit could movement sense similar. Spend can oil member. Staff sometimes character value.",Critical,Open,Network,IT,Jenna Cunningham,,2025-02-12 11:45:07,,4,,False,
TKT-000738,Multi-channeled didactic orchestration,First threat series. Watch others quite imagine bring sometimes join. Create free between response building citizen chair.,Medium,Resolved,Software,Marketing,Patricia Cox,Cameron Wilcox,2025-02-28 09:43:12,2025-03-01 19:08:00.419535,24,33.41344987082371,False,
TKT-000739,Optimized client-server superstructure,Parent experience conference. Be thus food those employee play prove chance.,Medium,Resolved,Software,IT,Daniel Roy,Tammy Brown,2025-07-12 13:33:06,2025-07-13 08:42:09.187040,24,19.150885288906707,True,
TKT-000740,Multi-lateral bifurcated framework,"Wait life task. Field sit and lay want southern matter.
Factor resource college reason show until wonder suggest. Now send today letter quickly budget.",Low,Resolved,Access,Sales,Ricardo Ayala,Kristen Mcguire,2025-07-20 20:58:49,2025-07-21 17:29:11.465524,72,20.50624042346017,True,
TKT-000741,Triple-buffered homogeneous algorithm,Site act citizen claim price much. High forward each middle investment student center staff. Since here weight fill according give.,High,Open,Security,HR,Christopher Farrell,,2025-05-18 17:55:50,,8,,False,
TKT-000742,Fully-configurable disintermediate time-frame,Religious young eight think hotel on. Always property scientist put. One wife activity raise significant.,Low,Open,Access,Finance,Cory Bailey,,2025-07-14 05:19:37,,72,,False,
TKT-000743,Re-contextualized secondary conglomeration,"You wide current note magazine blue know. Affect beautiful along study water.
Election month marriage kid key system. Material without feel else miss church better stock.",Low,In Progress,Access,HR,Timothy Thomas,Samantha Rose,2025-03-30 04:12:51,,72,,False,
TKT-000744,Future-proofed human-resource paradigm,"The join develop official. Effect ready late address.
Service save bank word church order. Power picture price second relationship. Inside language language.",Low,In Progress,Printer,Operations,Logan Fowler,Martin Collins,2025-04-11 16:14:56,,72,,False,
TKT-000745,User-centric contextually-based conglomeration,"More tree public put who down. Far or strategy professor benefit fact purpose.
Food artist production after range. Meeting work reality community ball responsibility stage.",High,Resolved,Email,Sales,Anthony Holt,Brenda Young,2025-03-01 17:21:02,2025-03-01 21:32:48.358196,8,4.196210610029485,True,
TKT-000746,Centralized grid-enabled framework,"Send person do yes tell avoid. Worry design fine expert travel occur will your. Finally wide old appear how decide.
Home left surface war his admit. Turn enough figure technology machine top.",Low,Open,Printer,IT,Craig Wood,,2025-02-06 19:29:53,,72,,False,
TKT-000747,Visionary hybrid orchestration,"Ahead just race ready put somebody. Trip rather send figure join about friend. Four under until return.
Sing feeling remain save. Accept dinner travel organization difficult list suddenly.",Medium,In Progress,Hardware,IT,Cindy Brown,William Salazar,2025-04-05 10:54:10,,24,,False,
TKT-000748,Down-sized real-time capability,"Leg pretty fear whose finally. Day husband safe. Everyone different home whose line region.
Specific act visit. Discover approach major various win late.",Medium,Resolved,Security,Finance,Eric Harrington,Patricia Ball,2025-04-15 15:05:58,2025-04-16 22:47:46.360632,24,31.696766842231504,False,
TKT-000749,Virtual background software,"Him social lot community lead. Buy brother sense.
Other machine technology. Sometimes reason approach appear lay.
Base agency last treat.",Medium,Closed,Network,Sales,Cody Fernandez,Gregory Lopez,2025-06-25 18:10:43,2025-06-26 15:59:49.659239,24,21.81851645520126,True,5.0
TKT-000750,Team-oriented methodical core,"Science stuff share result hold police.
Source gun notice. Win let according learn according.
Window standard fear nation stay. Yourself how benefit.",Medium,Open,Email,Finance,Alexander Hubbard,,2025-06-15 16:43:02,,24,,False,
TKT-000751,Sharable tangible approach,"Second build large rather single share. Spring these statement response size election president.
More fear participant kid account available. Line deep easy education couple sometimes democratic.",Low,Resolved,Security,Marketing,Gabriel Tyler,Danny Lane,2025-07-02 18:20:49,2025-07-05 15:55:58.407977,72,69.58594666032924,True,
TKT-000752,Business-focused grid-enabled interface,Stage sense race staff test media. Step decision huge win three growth. Popular whether improve paper watch appear.,Critical,Closed,Network,HR,David Reid,Deanna Rivera,2025-06-15 07:20:11,2025-06-15 10:43:08.748041,4,3.382707789111391,True,4.0
TKT-000753,Proactive asymmetric access,Money public hope knowledge. Resource miss room nice. Season machine night station owner responsibility. Growth idea benefit resource.,Low,Resolved,Software,IT,Alisha Jefferson,Philip Gallagher,2025-07-08 01:19:33,2025-07-08 15:02:54.574774,72,13.722659659355443,True,
TKT-000754,Fully-configurable disintermediate matrix,"Half challenge we term agreement type five up. Democratic director eight physical. Inside public pass design ability. Happen issue Democrat where computer rule.
Difficult nice activity head.",Medium,Resolved,Email,Finance,Jason Carey DDS,Philip Howell,2025-07-21 02:40:23,2025-07-21 10:41:02.006164,24,8.010835045535323,True,
TKT-000755,Virtual local workforce,"Fast include change Mr simply everything attention. Adult high as present her wonder standard.
Then room do democratic. Impact finally perform difficult place relate. Service bank night.",Medium,In Progress,Printer,IT,Andrew Rios II,Julie Keller,2025-06-15 22:32:42,,24,,False,
TKT-000756,Organized mission-critical strategy,"Family course share second wide yeah. Image opportunity suggest because PM commercial.
Human almost tax answer adult. Rich face one. Degree within fly cut report check.",Low,Closed,Access,IT,Jeffery Davila,Jessica Mccoy,2025-02-08 20:20:59,2025-02-13 04:12:25.194107,72,103.85727614084288,False,4.0
TKT-000757,Distributed multimedia collaboration,Air north home their add north. Nothing health possible final employee instead. Nearly pattern husband style remember property treat rise.,Medium,Closed,Software,IT,Michael Cruz,Anthony Williams,2025-03-02 20:45:47,2025-03-03 16:26:53.402795,24,19.685111887418557,True,3.0
