ticket_id,title,description,priority,status,category,department,requester,assignee,created_date,resolved_date,sla_target_hours,resolution_hours,sla_met,customer_satisfaction
TKT-000254,Fundamental reciprocal orchestration,"Simply continue anything.
Investment argue door card matter take. Campaign rise impact free rate.",Low,Closed,Software,Finance,John Horn,Christy Garcia,2025-02-24 21:00:25,2025-02-25 18:44:15.170469,72,21.73060290798172,True,5.0
TKT-000255,Cross-group multimedia forecast,Crime skill situation person human. Notice always true once read six pressure. Important hold lawyer let.,Medium,Closed,Software,IT,Teresa Pacheco,Jodi Fields,2025-01-28 00:23:55,2025-01-29 03:16:49.548461,24,26.881819016810905,False,5.0
TKT-000256,Expanded web-enabled archive,"Local beat east its or force relationship.
Risk cause raise. Practice friend a. Everybody walk play sense window it.",Medium,Resolved,Access,Finance,Leslie Hoffman,Maria Miller,2025-03-22 11:58:07,2025-03-23 05:06:38.168888,24,17.14199135770623,True,
TKT-000257,Decentralized asymmetric analyzer,Coach back all bad drug cold manage. Role window use push people culture alone especially. Detail star program case trip red.,High,Resolved,Software,IT,Charles Schmidt,Robert Rodriguez,2025-07-08 01:06:51,2025-07-08 10:03:34.458612,8,8.945405170078471,False,
TKT-000258,Versatile optimal budgetary management,Head white option event. Resource wear wall camera laugh Republican Mrs pull. Treat local unit thing environmental on analysis.,High,Closed,Security,HR,Heather Gillespie,Brian Allen,2025-06-18 05:47:14,2025-06-18 10:37:41.342525,8,4.840928479126877,True,5.0
TKT-000259,Grass-roots modular firmware,"Summer out front ever.
Land design help sing against. Five each whom treatment police particularly wrong. Result cultural successful more.
Everything night method away none. Lot live town.",Low,Open,Software,IT,Thomas Martinez,,2025-02-04 17:41:54,,72,,False,
TKT-000260,Balanced incremental encoding,"Citizen brother charge spend rich go common.
Money international Mrs choose risk. Experience current product source.
Its term after method.",Low,Resolved,Software,Marketing,Wayne Haynes,Christine Morris,2025-06-28 20:34:53,2025-07-01 06:32:37.933808,72,57.962481613304305,True,
TKT-000261,Advanced zero administration system engine,Scientist speak among water. Choose involve before beyond choose camera act. Change smile degree consider physical. View matter gas because.,High,In Progress,Email,Legal,Margaret Smith,Brandon Mcgrath,2025-04-02 04:17:47,,8,,False,
TKT-000262,Integrated incremental archive,"Lose get design family best article rest. Thus approach itself soldier compare sort fact. How want head seek. Mrs guy whatever this over almost health.
Return ever according politics book behavior.",Medium,In Progress,Software,IT,John Franklin,Rebecca May,2025-03-10 16:29:28,,24,,False,
TKT-000263,Enhanced hybrid emulation,"Reach whom rise image color front growth. Near participant condition need expert community.
Start assume election agreement young able. Use medical they serious.",Low,Open,Network,Finance,Craig Hobbs,,2025-04-12 18:24:35,,72,,False,
TKT-000264,Re-engineered disintermediate moderator,Garden offer second.,Low,Resolved,Hardware,Finance,Kaitlin Bates,Kevin Hernandez,2025-07-01 16:04:02,2025-07-05 04:57:00.846883,72,84.88301302294873,False,
TKT-000265,Managed 24hour knowledgebase,"Least grow thought would. Address last remember care wind too. Agency that cold security reduce.
Town everything short anything without their miss line. Kitchen memory compare attack.",Medium,Open,Phone,IT,Tonya Cherry,,2025-07-19 11:48:04,,24,,False,
TKT-000266,User-centric 5thgeneration functionalities,"Up hand trouble. Perhaps conference different while brother range forget final.
Daughter score rule effect. Go size per he.
Generation teacher born. Source sense always last begin a last voice.",High,In Progress,Access,IT,Matthew Kaufman,Philip Cooper,2025-03-01 22:31:18,,8,,False,
TKT-000267,Distributed asynchronous firmware,Nation team college close teach authority. Mind song learn so increase office couple. Market your return activity instead claim significant anything.,Medium,Closed,Access,IT,Mark Jones,Kevin Preston,2025-07-19 13:41:59,2025-07-20 02:07:03.120875,24,12.417811354141303,True,3.0
TKT-000268,Up-sized reciprocal matrix,"Top air event. Stage they why owner until.
Gun idea choice. Them local indicate give. Painting water same let free.
President large drive other available few program term.",High,Closed,Phone,IT,Thomas Turner,Caleb King,2025-07-01 19:02:13,2025-07-01 20:07:45.792890,8,1.0924424694992805,True,5.0
TKT-000269,Grass-roots holistic concept,"Room keep common top. General four around sort outside control item. To safe size stop support.
Smile term power drop. Ago popular issue two important attorney. Will consumer who relationship sister.",Low,In Progress,Email,IT,William Smith,Lisa Mahoney,2025-04-07 11:38:01,,72,,False,
TKT-000270,Total contextually-based extranet,Person floor time approach us agency. Through offer bank world animal affect. Ball phone late reveal picture school.,Medium,Resolved,Hardware,IT,Sonya Galloway,Joanne Mosley,2025-06-27 14:41:59,2025-06-28 07:46:17.813444,24,17.071892623308706,True,
TKT-000271,Total 24/7 info-mediaries,"Whose table big must. State direction quality.
Author western heart billion language. Political even deal college camera science TV member. Themselves different far easy show approach start.",High,Closed,Software,IT,Gail Owens,Devon Carter,2025-05-16 08:36:53,2025-05-16 18:10:58.287477,8,9.56813541027218,False,5.0
TKT-000272,Public-key mission-critical Local Area Network,"Improve realize his American.
Right report season single. Clear wear before.
Loss collection just goal. Everything character get his seat bit modern. Board authority real pick new who.",Critical,Closed,Software,Marketing,Bryan Hall,Amy Fuller,2025-04-19 21:50:48,2025-04-19 22:50:48.000000,4,1.0,True,5.0
TKT-000273,Reactive multi-tasking complexity,"Speech heavy foreign heavy whatever main.
Serious billion later early. Top interest candidate camera officer direction door. Camera consumer deep send piece television there.",Medium,Open,Access,IT,John Lewis,,2025-04-04 10:03:51,,24,,False,
TKT-000274,Switchable non-volatile middleware,Pretty music citizen involve table memory who. Challenge fly his customer form site. Him interest job such dinner option. Always situation power charge loss.,High,In Progress,Network,IT,Vanessa Hogan,Christy Good,2025-05-29 17:29:00,,8,,False,
TKT-000275,Cross-platform intangible leverage,"Century they candidate mother market. So throw per smile entire building key. You share man raise.
Enjoy establish but city why.",High,Resolved,Phone,HR,Leslie Perkins,Christopher Lynch,2025-04-02 16:32:06,2025-04-03 04:12:22.174879,8,11.671159688537303,False,
TKT-000276,Automated neutral process improvement,"Pick compare only reality. Strong central consider hold say must save. No laugh team not pattern call.
Candidate test special figure fill. Federal kind establish their.",Medium,Pending,Hardware,Operations,Stephen Davis,Alan Harris,2025-07-18 15:35:22,,24,,False,
TKT-000277,Reduced human-resource conglomeration,"Together kind war. Computer recently score politics.
Summer worry his wear color.
Help capital baby form democratic.",Low,Resolved,Software,HR,Andrea Shea,Robert Soto,2025-02-03 01:59:06,2025-02-07 00:22:44.772813,72,94.39410355923965,False,
TKT-000278,Synergistic tangible installation,Tax describe either air provide city. Suddenly life effort nothing trouble. Middle over court miss production bank.,Low,Closed,Security,HR,Christian Roy,Katie Taylor,2025-02-03 20:42:20,2025-02-06 07:54:43.772665,72,59.20660351808011,True,3.0
TKT-000279,Integrated 6thgeneration middleware,"Player really control without.
Head growth indicate voice. Land evidence image Republican. Huge both reach meeting course day.",Low,Resolved,Network,HR,Ralph Fleming,Anna Pena,2025-05-10 04:26:22,2025-05-13 16:42:30.251852,72,84.2689588477172,False,
TKT-000280,Implemented tangible policy,"My sell challenge finish part discover. Should cover last least method too go. Big image onto strong cell.
Suggest figure determine impact. Nothing available effect treat room edge current.",Low,Closed,Hardware,Marketing,Bruce Price,Russell Allen,2025-02-08 03:57:28,2025-02-09 19:14:25.650579,72,39.28268071640241,True,4.0
TKT-000281,Public-key composite knowledge user,Former prevent five trouble research too end. President short stock body thing husband claim suddenly.,Medium,Open,Software,Operations,George Patton,,2025-01-31 20:20:10,,24,,False,
TKT-000282,Fundamental incremental Local Area Network,"Though color leader wide require him consumer. Forward magazine tough during.
Loss rich hour change what live pass. Beyond audience region business understand notice author.",Low,Pending,Network,IT,Robert Allen,Kelly Johnson,2025-06-02 02:11:09,,72,,False,
TKT-000283,Expanded multi-tasking workforce,"Present all media dream car. Purpose fact trip officer item.
Well wish one me notice. White not and whatever message sign language.",Low,Resolved,Software,HR,Joseph Padilla,Cheryl Chase,2025-04-03 10:54:10,2025-04-05 09:26:20.468698,72,46.5362413049426,True,
TKT-000284,Fully-configurable hybrid Local Area Network,"Deal debate life for. Let major important case. Charge base accept force public.
Official wall network. Customer effort popular detail walk wide future.",Critical,Resolved,Email,Sales,Brian Barnes,Gail Ray,2025-01-21 21:09:21,2025-01-22 00:12:03.383383,4,3.0451064953365643,True,
TKT-000285,Ergonomic dynamic Internet solution,"Clearly good run people. Upon activity those.
Power message song ever Congress east too perform. Find later behavior sell.
Like away less end say interview.",Low,Resolved,Software,HR,Traci Burnett,Carol Potter,2025-04-25 21:50:37,2025-04-29 17:32:28.050509,72,91.69751403020769,False,
TKT-000286,Profit-focused real-time infrastructure,"Management protect key factor relate. Later push agent institution among cause. Detail approach policy line tough ball people. Election walk herself.
Once inside during hit. Shake plant guess notice.",Critical,Closed,Hardware,HR,David Jenkins,Katie Oneill,2025-07-03 15:21:43,2025-07-03 21:22:07.430988,4,6.0067863854778,False,4.0
TKT-000287,Team-oriented eco-centric algorithm,"Better rate instead her. Development one people effect reveal adult. Something blue too data reveal method always.
Market career run compare. Produce data world too call skin TV.",Low,Resolved,Security,IT,Nicholas Burns,Amanda Thomas,2025-07-22 13:21:32,2025-07-24 14:35:08.574366,72,49.22682621288721,True,
TKT-000288,Innovative disintermediate benchmark,"Sit imagine left amount hope child.
Cut sign pattern resource campaign agency clear. Carry doctor another modern.",Low,Resolved,Software,IT,Kathy Johnson,Christian Ramirez,2025-07-22 00:59:23,2025-07-22 04:31:47.678266,72,3.5401884071275305,True,
TKT-000289,Multi-layered explicit Internet solution,"Reduce resource wrong toward story else nice. Trade high population and. Police body force ten.
People treat hear window live hand film. Offer raise more.",Medium,In Progress,Email,IT,Lee Charles,Charles Cruz,2025-07-04 09:58:16,,24,,False,
TKT-000290,Multi-lateral encompassing core,Performance which owner budget have drug. Material third camera big adult shoulder up as. Story say team system camera.,Medium,Open,Hardware,IT,Zachary Lopez,,2025-04-23 07:48:55,,24,,False,
TKT-000291,Operative secondary capability,"Person play test training easy court. Prove his about pressure. Set south fill within happy make.
Artist about letter establish.",Medium,Resolved,Printer,Sales,Christina Ross,Cory Holt,2025-03-21 14:17:32,2025-03-21 22:52:03.064086,24,8.575295579473718,True,
TKT-000292,Monitored bifurcated workforce,Tv success color our war control. Save turn arm particularly. Chair approach all them win TV color always.,Low,Pending,Printer,Marketing,Patricia Cardenas,Samuel Walters,2025-04-08 12:37:19,,72,,False,
TKT-000293,Cross-group client-driven intranet,"Son value prepare edge pull own minute way. Sound adult throw day together economy may because. Worry civil than heavy.
Age catch look line.",Medium,Resolved,Security,Sales,Jo Serrano,Carolyn Murphy,2025-01-24 16:46:33,2025-01-25 13:36:59.780636,24,20.84077239902596,True,
TKT-000294,Virtual responsive productivity,Size once during computer fight. Democratic building our three effort individual media. Part reflect anything tend quality.,Low,In Progress,Security,Sales,John Kane,Oscar Kirby,2025-05-15 22:35:20,,72,,False,
TKT-000295,Open-architected impactful initiative,"Law treat think occur ask cultural. Environmental president all research act outside.
Better beyond show visit ball perhaps anyone interview. Story into south myself mean.",Critical,Open,Access,Legal,Mary Ramos,,2025-04-09 07:28:21,,4,,False,
TKT-000296,Digitized directional info-mediaries,Congress beautiful perhaps worker radio base. Station room well whatever along drop.,Medium,Closed,Access,Marketing,Grace Prince,Adam Summers,2025-02-05 22:43:29,2025-02-07 00:50:11.289098,24,26.111746971650177,False,2.0
TKT-000297,Public-key secondary utilization,"Trial source get itself.
Just miss enough nothing. Ready usually only figure business. Community whom in again spend suggest raise take. Shoulder service same opportunity nothing response weight.",Low,Resolved,Printer,HR,Joshua Williams,Jacob Price,2025-04-24 07:54:47,2025-04-27 09:48:12.469679,72,73.89040824430178,False,
TKT-000298,Stand-alone stable application,Service well film. Exactly wear long kind budget instead. Agreement participant car scientist.,High,Resolved,Access,Marketing,Kimberly Doyle,Sarah Lamb,2025-06-13 02:04:26,2025-06-13 12:43:19.360710,8,10.648155752891512,False,
TKT-000299,Focused solution-oriented solution,"Star effect agree American car project. Sign billion science be experience trial in.
Gun be happy program. Clearly figure beyond third why yard.",Low,Open,Access,Finance,Tracy Bauer,,2025-06-12 23:28:37,,72,,False,
TKT-000300,Switchable hybrid moratorium,"Material trade gun us this game occur. Evidence next provide call.
Cell modern protect left also. Easy share yard. Brother baby result choose summer.",Low,Resolved,Access,HR,Alexander Harrison,Jason Barajas,2025-07-01 21:07:13,2025-07-03 14:31:14.783136,72,41.40049531557034,True,
TKT-000301,Upgradable maximized leverage,Feeling behind research red close person smile. Pass require buy likely room sign.,Medium,Closed,Hardware,HR,Brandon Guerra,Kristina Hill,2025-04-28 05:37:45,2025-04-29 05:58:41.734074,24,24.34909279839185,False,4.0
TKT-000302,Function-based background forecast,"Dark room official he wait blue.
Interesting might big artist their use mouth. Throughout pay program thought nor after.",Low,Open,Access,Marketing,Paul Burns,,2025-05-30 08:40:52,,72,,False,
TKT-000303,Team-oriented heuristic focus group,Visit use build carry. Anything standard most. Act happen instead many develop. Speech answer role close defense key attack.,Medium,Pending,Network,Sales,Robert Hall,Christopher Pittman,2025-02-03 12:25:42,,24,,False,
TKT-000304,Customizable human-resource Graphic Interface,"Reduce kind compare point investment. Traditional live hit art court.
Fast page help unit south. Student bill say treat enjoy find building ever. Guess per them continue movie speak American.",Low,Resolved,Hardware,Operations,Tonya Young,Michael Graves,2025-03-10 22:38:41,2025-03-12 16:27:39.466356,72,41.81624065454666,True,
TKT-000305,Universal incremental extranet,"Statement ground president suffer the safe international. Law push meet argue camera.
Actually PM evening executive sport ball. Administration receive themselves guy general world.",Low,Open,Software,Finance,Paul Wolf,,2025-05-21 01:52:16,,72,,False,
TKT-000306,Future-proofed composite model,"Sport executive force sport.
Western suffer improve learn western imagine police. Picture part challenge smile. Agent edge discuss provide matter fight top land.",Medium,Open,Security,IT,Theresa Graham,,2025-03-05 23:00:54,,24,,False,
TKT-000307,Vision-oriented static synergy,Why store common hospital step scientist. Wait look very father central usually family senior. Law forget nearly number president.,Low,Closed,Hardware,IT,Christina Richardson,Christopher Smith,2025-02-20 01:24:43,2025-02-24 04:51:15.694325,72,99.4424150903136,False,3.0
TKT-000308,Reverse-engineered systematic structure,"Over technology feel read day your others. It beat entire continue seek it.
Image do health if thousand first claim. Compare fall challenge so either.",Low,In Progress,Network,Sales,John Wilson,Devin Brown PhD,2025-02-19 11:23:49,,72,,False,
TKT-000309,Exclusive full-range benchmark,"Compare radio any street.
Class two project finish claim seat director. High decade at shoulder present. Green floor city rule exist rate.",Low,In Progress,Access,HR,Lori Nelson,Michael Guzman,2025-07-10 01:37:21,,72,,False,
TKT-000310,Seamless interactive hierarchy,Result shoulder professional if either by. Money media model plant bar trouble above. Begin hot want guy training recently north new.,Low,In Progress,Hardware,Operations,Mrs. Emily Lee DVM,John Neal,2025-05-22 10:26:34,,72,,False,
TKT-000311,Re-engineered secondary Graphical User Interface,Book fire language already television ten as. Receive adult fund reason difference. Note full nothing fund face away.,Medium,Resolved,Software,Legal,Rachel George,Lori Riggs,2025-06-08 11:48:07,2025-06-09 12:02:46.085215,24,24.24419033763427,False,
TKT-000312,Front-line modular project,Television purpose side share. Positive Congress ask defense might public. Produce light gun within.,Low,Resolved,Printer,IT,Laurie Colon,Robert Martinez,2025-05-30 19:08:56,2025-06-02 03:46:02.306557,72,56.618418488065224,True,
TKT-000313,Integrated grid-enabled paradigm,"Sort Democrat together television. Better artist me cold military.
Station baby she when probably attention soldier. Real exactly opportunity allow. Camera benefit travel approach structure yourself.",Low,Resolved,Network,IT,Brian Allen,Erik Scott,2025-03-20 08:34:39,2025-03-23 05:36:25.036513,72,69.02945458699158,True,
TKT-000314,Focused incremental hierarchy,Light onto sell opportunity suddenly throw. Create down sea free paper enjoy hand. Drug agree board tell her economic require item. Service wide piece cost whether authority.,Medium,Resolved,Software,HR,Lauren Miller,Mark Stevens,2025-03-11 13:55:43,2025-03-13 02:16:23.396933,24,36.34455470362953,False,
TKT-000315,Ergonomic upward-trending matrices,"Piece foot two person. Everybody impact about. Include front peace budget ok.
Interest total important about agreement marriage seven. Performance benefit dog smile return.
Method support claim give.",Medium,In Progress,Email,HR,Daniel Simon,Denise Nixon,2025-02-27 10:29:48,,24,,False,
TKT-000316,Switchable human-resource flexibility,"Activity way else fact try conference bit. Enough defense low suddenly expect prevent.
Why those account partner author defense structure.",Low,Resolved,Software,HR,Courtney Best,Joyce Best,2025-05-19 08:08:49,2025-05-20 18:04:43.777041,72,33.931882511383535,True,
TKT-000317,Monitored transitional circuit,"Society word story probably not anything well. Pretty account trip base. Site successful war word sign.
Yard smile leave run bring important. South quickly serious arrive major.",Critical,Resolved,Software,Operations,Henry Jackson,Melissa Reed,2025-07-10 18:59:40,2025-07-10 23:23:21.232040,4,4.394786677664152,False,
TKT-000318,Phased 5thgeneration support,"Question money among tree. Assume run which such.
Very him oil the. That that shoulder glass charge school word history.
Occur carry arm house. Evening debate example.",Critical,Open,Security,HR,Margaret Martinez,,2025-03-12 06:31:06,,4,,False,
TKT-000319,Progressive 24/7 knowledgebase,Hand tree your sometimes evening. Spend today resource effort least really current south.,Low,Resolved,Access,Marketing,Tracey Martinez,Sandra Peters MD,2025-04-12 17:34:05,2025-04-14 09:17:54.137285,72,39.73031591252683,True,
TKT-000320,Customer-focused contextually-based Internet solution,"Want inside surface. Involve including society cell certain support whom. Around police suggest.
Society bit popular size physical west. Old already alone all dinner all. At peace may argue.",Low,Open,Access,Operations,Morgan Rodriguez,,2025-06-10 06:43:12,,72,,False,
TKT-000321,Focused didactic matrices,"Would center picture air whatever. Forward film charge note it large improve. Physical democratic exactly story.
Prove president performance include. Analysis agency truth consumer huge.",Low,Resolved,Software,Operations,Laura Jones MD,Jordan Olson,2025-03-17 05:15:47,2025-03-21 15:44:44.481093,72,106.4826336368894,False,
TKT-000322,Intuitive bi-directional capacity,Modern feel mean world sell. Market none start street story. Travel plant charge run any itself account. Scene feel treat strategy test mind first.,Low,Resolved,Hardware,HR,Daniel Rios,Hannah Miller,2025-05-11 01:05:51,2025-05-13 04:44:58.734509,72,51.6521484747532,True,
TKT-000323,Balanced multi-tasking groupware,"Window chance worker. Half memory avoid control try.
Quickly ready health minute present. Two financial result they. Eat allow industry its others.",Low,Resolved,Printer,HR,Kevin Edwards,Christie Shaffer,2025-03-31 06:12:00,2025-04-01 07:12:24.493839,72,25.006803844057707,True,
TKT-000324,Re-contextualized coherent system engine,Give stop almost send everyone too mouth. Professor per at team arm like worry. Recognize number dinner low. Method cup claim nothing late.,High,Closed,Software,Sales,Stephen Oneal,Christopher Garza,2025-05-08 16:44:32,2025-05-08 20:15:38.514404,8,3.5184762233078164,True,3.0
TKT-000325,Configurable transitional function,Break quite true must. Onto certain whom rich item little reduce. Environment him local body hand. Throughout wife subject maybe program picture leave.,Medium,Pending,Hardware,IT,George Rivera,Bryan Lopez,2025-01-24 05:54:29,,24,,False,
TKT-000326,Expanded real-time intranet,"Exist between surface yes house. Home oil hotel tax market painting feel woman.
Scene cover thank. Read national approach.
Bag ball consider floor Mr another. Sort last someone agreement carry guy.",Medium,Open,Hardware,IT,John Jimenez,,2025-05-09 20:43:11,,24,,False,
TKT-000327,Virtual 5thgeneration software,"Cause be care officer free several talk. Piece camera chair sometimes standard tell.
Series yourself certain. Center position account.",Medium,Open,Network,IT,Paul Matthews,,2025-06-10 05:45:38,,24,,False,
TKT-000328,Optimized uniform database,Movement level bill herself buy pressure service. Both control free pretty war claim avoid.,High,In Progress,Software,Operations,Lisa Casey,Brian Krueger,2025-03-28 07:52:09,,8,,False,
TKT-000329,Profit-focused upward-trending archive,"Return seek recent design she lawyer do middle. Thousand add you candidate. Manager more late offer page far source brother.
Interview upon loss theory appear. Be owner remain question wrong.",Medium,Pending,Network,Operations,Jessica Taylor,Stacey King,2025-02-06 01:12:53,,24,,False,
TKT-000330,Persistent mission-critical methodology,Someone page unit activity group expert if. Buy yes seven buy home per turn local. Authority leader majority investment.,Low,Resolved,Access,Finance,Amy Alexander,Patricia Norris,2025-02-28 21:01:23,2025-03-04 10:33:07.857090,72,85.52912696948084,False,
TKT-000331,Fully-configurable client-server open system,"Require area hope bank probably I eat. Recently staff that.
Might she American instead grow still. Within unit speech race job half. Gas station left face agreement.",High,Open,Software,Legal,Alan Cole,,2025-03-28 21:33:09,,8,,False,
TKT-000332,Optimized motivating architecture,Majority him fine position discussion. National seem talk west baby also between.,High,In Progress,Access,Operations,Mr. Thomas Herrera,Michelle Shaw,2025-02-23 20:47:12,,8,,False,
TKT-000333,Optimized clear-thinking solution,Where partner serve crime natural real program. Water win available new southern trial movement example. Question meet song significant although make.,High,Resolved,Network,Operations,Betty Valentine,Melissa Dominguez,2025-04-26 03:08:46,2025-04-26 07:08:04.426271,8,3.988451742020644,True,
TKT-000334,Re-contextualized next generation complexity,Actually environmental image strategy open improve purpose make. Town just poor ten house short its.,Critical,Resolved,Printer,IT,Melissa Phillips,Sherry Whitaker,2025-03-09 13:26:20,2025-03-09 17:00:48.276448,4,3.574521235649038,True,
TKT-000335,Progressive content-based knowledge user,"From what vote culture wish nice.
Either century stand really itself should. Difficult experience pull close. Care far election upon issue as support.",High,Closed,Phone,Finance,Jesse Erickson,Joshua Hill,2025-06-20 03:36:25,2025-06-20 14:13:44.213013,8,10.622003614804875,False,5.0
TKT-000336,Profit-focused eco-centric array,"Tree traditional there significant. Character behind once east enough common study.
Production partner plant voice administration model actually. Each provide region present music home scene.",High,Resolved,Email,IT,Corey White,Kimberly Aguirre,2025-07-12 01:59:23,2025-07-12 08:54:25.604564,8,6.917390156647637,True,
TKT-000337,Extended uniform intranet,"Real practice kid strategy. Western role draw idea. If center job the question somebody child.
Walk tree dog see brother different. Her worker paper mean understand sense improve rich.",Medium,Resolved,Access,IT,Lauren Houston,Michael Morrow,2025-07-01 21:15:31,2025-07-02 11:52:20.244287,24,14.613678968680127,True,
