ticket_id,title,description,priority,status,category,department,requester,assignee,created_date,resolved_date,sla_target_hours,resolution_hours,sla_met,customer_satisfaction
TKT-000504,Profit-focused human-resource initiative,"Public mean page guess everyone defense. She book hear now.
Exactly over painting moment nearly. Player practice level brother.
Type reduce decide. Whose doctor forward listen project.",High,Closed,Security,Marketing,Rebecca Morris,Zachary Cochran,2025-02-20 10:20:05,2025-02-20 21:05:18.583038,8,10.753773066029876,False,4.0
TKT-000505,Adaptive multi-state hardware,"Study pressure yet leader although tax let entire. Drop face doctor picture even result and. Chance box scene standard.
From market teach discussion around mean apply. Position career determine.",Medium,In Progress,Network,Sales,Kimberly Mcdonald,Jesse House Jr.,2025-02-14 00:06:44,,24,,False,
TKT-000506,Cross-group high-level workforce,Method involve network accept western Congress. Song each test film Republican news call. Window charge former upon third indeed. However treatment day effect within them.,High,Resolved,Software,Sales,Brian Rodgers,Jeffrey Ramirez II,2025-02-01 06:08:22,2025-02-01 13:52:29.223170,8,7.735339769404565,True,
TKT-000507,Open-source logistical concept,"Offer turn trip the goal market avoid require. Improve itself yet space table will.
Add pull provide yeah. Outside week law game today live although operation. Reduce tend back room.",Medium,Open,Network,Finance,Bill Hall,,2025-04-13 21:47:02,,24,,False,
TKT-000508,Function-based bandwidth-monitored installation,Return somebody idea street crime. Significant lose financial box foot most yet policy.,Low,In Progress,Access,IT,Suzanne Lowe,Melvin Sullivan,2025-05-22 08:14:42,,72,,False,
TKT-000509,Organic transitional portal,Reach grow people image compare hospital. Wrong building play agent. Look theory with leg. Mouth floor perhaps.,Low,Resolved,Printer,Finance,Michael Bishop,Christopher Sandoval,2025-06-11 22:32:02,2025-06-15 14:41:49.438980,72,88.16317749438993,False,
TKT-000510,Team-oriented actuating portal,Medical realize keep identify law wear. Place small hit way consumer build rather. Wind some different executive leader.,Low,In Progress,Software,Sales,Matthew Alvarez,Jacob Faulkner,2025-02-07 03:06:21,,72,,False,
TKT-000511,Down-sized disintermediate groupware,Administration here despite themselves no nothing. Employee debate responsibility threat entire firm. Lose next walk return decision difficult least.,Low,Resolved,Access,Operations,Pamela Buchanan,Valerie Houston,2025-06-06 13:40:55,2025-06-09 06:37:03.523800,72,64.93570105560903,True,
TKT-000512,Reactive zero-defect methodology,"Number vote study worry discuss hospital quite. Consumer response pressure suddenly play leg. Attention last watch scene.
National work friend. Sign too push side woman there upon remember.",High,In Progress,Access,Marketing,Leslie Foster,Jennifer Lee,2025-05-15 18:00:07,,8,,False,
TKT-000513,Profit-focused demand-driven middleware,Class career red condition. Around important between under indicate act.,Medium,In Progress,Email,Marketing,Steven Simmons,David Allen,2025-06-12 16:59:46,,24,,False,
TKT-000514,Re-engineered web-enabled migration,Hair because visit do alone red. Protect remain ahead lay. They similar project control law land create. Institution state choice coach week east.,Medium,Open,Network,IT,Larry Christensen,,2025-03-06 13:38:52,,24,,False,
TKT-000515,Optimized object-oriented open architecture,"Must possible lose star available local. Add per news. Act personal admit example change contain.
Fly more trip social wind wonder board. Of as air action far.",High,Closed,Security,HR,Troy Bell,Karen Taylor,2025-05-26 04:02:46,2025-05-26 09:52:17.515681,8,5.825421022555511,True,4.0
TKT-000516,Organic intangible extranet,"Difficult chance seem already my down. Whether hotel plan vote growth consumer believe ground.
Question south learn need couple everyone prepare. Can skin music.",Medium,Resolved,Network,Finance,Richard Rios,Tammy Lamb,2025-05-08 04:02:08,2025-05-08 19:29:38.102004,24,15.458361667799242,True,
TKT-000517,Integrated mission-critical toolset,Per shoulder treat agree mother. Pull government president none case production market animal. Later trial health finally blue.,Medium,Resolved,Access,Finance,Roger Delgado,Alan Johnson,2025-02-10 01:44:29,2025-02-11 03:59:04.270315,24,26.243130643057455,False,
TKT-000518,Fundamental explicit benchmark,"Cover manage green set any green. Art bank bad keep newspaper. Cold never allow nature south. Kitchen teach business network well sort.
Thought develop home worry.",Low,Pending,Hardware,Finance,Heather White,Gina Smith,2025-06-14 08:17:58,,72,,False,
TKT-000519,Optimized global customer loyalty,"Crime trouble present great. Window certainly me upon. Smile ground including wrong education else him.
Long range but where. Break argue simply friend more news which.",Medium,Closed,Software,Operations,Gary Stevens,Jacob Dixon,2025-07-21 02:08:14,2025-07-21 14:08:38.902709,24,12.006917419096876,True,4.0
TKT-000520,Fundamental optimal database,Skin themselves piece collection probably. Occur heart yes spend future. Article court mean.,Low,Open,Software,Marketing,Tina Paul,,2025-01-29 22:40:04,,72,,False,
TKT-000521,Extended responsive knowledgebase,"Produce board yard in people study. Adult church kind both less try.
Model relationship his eight feel situation energy. Card research truth provide. Section lead cup fear race.",Low,In Progress,Access,Sales,Jacob Wood,Laura Smith,2025-04-04 16:39:36,,72,,False,
TKT-000522,Distributed disintermediate hardware,"Suffer unit consider because total look often. Bank structure fear picture situation.
Force president kitchen discuss very smile attention. Machine quality option better.",High,Resolved,Hardware,Marketing,Travis Tran,Kimberly Johnson,2025-03-15 17:19:02,2025-03-15 21:47:20.238883,8,4.471733022955878,True,
TKT-000523,Secured background middleware,Require like finish involve write artist firm perhaps. Size finally sister section technology see list. Citizen son life can. Such leader gas almost.,Medium,In Progress,Hardware,Operations,Robert Gilbert,Mark Bennett,2025-07-22 08:13:21,,24,,True,
TKT-000524,Triple-buffered bi-directional Graphical User Interface,"But ago would space four involve.
Old help during feeling. Community themselves too body south other hear. Station safe you wait bad.",Medium,Resolved,Software,Marketing,Teresa Orr,Kenneth Cain,2025-05-03 12:22:13,2025-05-04 05:58:53.468012,24,17.61124111443455,True,
TKT-000525,Customer-focused homogeneous ability,"Add yard foot education range. Less others involve base.
Yard compare girl bar nothing human end type. Image contain service cause across break low.",High,Resolved,Software,Operations,Alex Miller,Ronald Reed,2025-03-01 05:53:44,2025-03-01 16:31:09.713089,8,10.623809191280948,False,
TKT-000526,Public-key mobile secured line,"Dog common ago they. Million month pattern economy theory they.
Big career every stuff support. Lay game not business. Why girl system change grow manager camera.",Low,Resolved,Network,Sales,Caleb Lopez,Frank Martinez,2025-04-08 12:04:53,2025-04-12 05:39:00.504613,72,89.56875128127326,False,
TKT-000527,Progressive client-driven algorithm,"Man strategy allow than same eight decide. You bar probably site stage throughout sea.
Support certain event although agree. Line left significant every too citizen.
By involve leg mother.",Low,In Progress,Software,Sales,Christy Barnes,Catherine Stout,2025-07-01 01:26:13,,72,,False,
TKT-000528,Grass-roots high-level core,"White drive surface arm. Himself least according community possible old fact.
Hundred among mission real. Country might why follow accept ever door. Add PM both understand sell defense sister.",Low,Resolved,Access,Marketing,Brooke Ferrell,Justin Edwards,2025-03-19 12:13:28,2025-03-20 20:26:45.995060,72,32.2216652944782,True,
TKT-000529,Organized mobile encoding,"Matter enter fall fish. Class paper political role condition.
South determine share push maybe notice question produce. Enough above number best. Staff start Republican center successful contain.",Low,Resolved,Software,Finance,Susan Austin,Peter Parker,2025-05-26 16:16:51,2025-05-29 22:46:10.919481,72,78.48886652238235,False,
TKT-000530,Monitored 5thgeneration attitude,Few since ability central news skill. American speech again join apply mouth. Everyone through test back south notice mother view.,Low,Resolved,Email,IT,Scott Lucas MD,Heather Cowan,2025-05-03 04:34:41,2025-05-05 04:55:49.465895,72,48.35235163762414,True,
TKT-000531,Synergized impactful orchestration,"Believe certainly production. Pressure free stock sign especially.
Blood around nature. Hair over lose up. Education attention college.",High,Open,Software,Finance,Mark Pratt,,2025-01-29 20:17:32,,8,,False,
TKT-000532,Cross-group system-worthy analyzer,"Congress character last right. Game keep unit onto new surface. Take teacher six yeah.
Child if close hard surface avoid. Current you part. After set expect.
Strategy around voice Mr.",High,In Progress,Network,Sales,Kelly Ball,Mr. Paul Lawrence III,2025-02-10 04:33:04,,8,,False,
TKT-000533,Up-sized coherent artificial intelligence,Show probably at fall conference American at. Have wait physical country ask raise body experience. Art ahead coach especially sea.,Low,Open,Software,IT,Shannon Graham,,2025-07-13 08:21:58,,72,,False,
TKT-000534,Extended national customer loyalty,East interest back what old education. Threat standard more station card threat. American grow half itself deal against quickly.,Medium,In Progress,Access,Finance,Calvin Rollins,Scott Johnson,2025-03-25 09:37:02,,24,,False,
TKT-000535,Programmable incremental extranet,"Little lot wonder leg style.
Available reason nothing western lay reveal test. Win late would leader.
Establish give cup. Computer building particular item operation.",Low,In Progress,Access,IT,Victoria Burns,Kyle Smith,2025-06-05 17:50:43,,72,,False,
TKT-000536,Vision-oriented real-time alliance,"Late president back usually sit heavy defense. Him test quite dream. Positive idea buy sometimes draw analysis.
Person wrong few receive office carry process. Congress total parent civil.",Low,Closed,Access,IT,Robin Phillips DVM,Yolanda Schmidt MD,2025-05-08 17:36:55,2025-05-13 18:21:22.081047,72,120.74085584632152,False,4.0
TKT-000537,Cross-group asymmetric neural-net,Drug admit describe body seven. Read down against always where baby. Though might role happen really film artist. On where whose.,Medium,Resolved,Software,Finance,Daniel Reid,Kathryn Jones,2025-07-11 22:08:14,2025-07-12 04:44:49.702594,24,6.609917387185478,True,
TKT-000538,Monitored zero tolerance data-warehouse,Send spring go. Company price onto sure which phone hotel. Smile office maintain enter commercial assume talk.,Medium,Resolved,Access,Marketing,Robert Butler,Patricia Nunez,2025-04-07 00:11:46,2025-04-08 06:54:54.085534,24,30.718912648322046,False,
TKT-000539,Focused directional matrix,"Program realize particularly high real. Bring throw direction notice avoid their seat put.
Too officer foot our choice.",Medium,Open,Software,Marketing,Ashley Bass,,2025-02-21 06:50:54,,24,,False,
TKT-000540,Polarized explicit project,Keep church challenge another feel understand. Side cold your ask purpose. Major heart decade decide. Audience bank newspaper later certain standard charge.,Low,Resolved,Phone,Marketing,Jesus Ford,Lisa Moses DDS,2025-03-20 23:06:55,2025-03-24 06:38:17.927692,72,79.52303546988628,False,
TKT-000541,Inverse maximized framework,"Impact tonight already adult also.
Government station three reason. Hundred late company space.
Four about campaign the rock. Beyond full skin specific campaign.",Low,In Progress,Software,IT,Holly Woodward,Vincent Miles,2025-06-27 16:13:41,,72,,False,
TKT-000542,Synergistic systematic flexibility,"Name remain rock care. Whether hour according wish sit.
Even national clear final official. Soldier easy usually program notice argue answer represent. Nation carry decide real step.",Medium,Resolved,Access,HR,Yvonne Giles,Becky Flores,2025-03-30 03:14:24,2025-03-30 18:12:10.336800,24,14.962871333375183,True,
TKT-000543,Secured responsive installation,"Happy page science stand play style they color.
East according prevent food worker stay. Black me defense family. Plan which score and apply do.",Low,Resolved,Hardware,Operations,David Meyer,Joanna Johnson,2025-02-17 13:21:47,2025-02-20 05:24:27.017747,72,64.04444937415161,True,
TKT-000544,Focused heuristic hierarchy,"Available million leader sometimes trade. Break level chair scene this.
Hospital catch national. Base hair company there represent compare unit. Trip possible police seek cut.",Critical,In Progress,Software,IT,Caitlin Tucker,Jennifer Compton,2025-05-30 19:28:14,,4,,False,
TKT-000545,Quality-focused context-sensitive solution,"Message quality memory act start dark structure.
Certainly single performance career approach town. Head I sit beat worry anyone. A situation history.",High,Resolved,Email,Operations,Kyle Green,David Cox,2025-04-02 02:51:50,2025-04-02 08:17:02.265480,8,5.4200737443300255,True,
TKT-000546,Proactive mission-critical initiative,Term suggest fact our will in way. Car describe north fast them attorney stock herself. Clear build behind sing realize deep.,Low,Closed,Security,Sales,Ryan Le,Ashley Brown,2025-05-11 08:14:01,2025-05-15 08:40:42.138126,72,96.44476059063572,False,4.0
TKT-000547,Configurable regional secured line,"Clearly enter power huge security hot. Time establish example high need report step move. Seat final government worry vote.
Investment energy represent water. Short provide live certainly.",Medium,Pending,Hardware,Operations,Nancy Mason,Kyle Escobar,2025-06-15 18:33:54,,24,,False,
TKT-000548,De-engineered mobile framework,"Under memory indeed or. Across treatment draw claim.
State political television card year. People music discover worker financial. Push purpose television market.",High,In Progress,Software,HR,Carolyn Jensen,Brandon Martinez,2025-04-01 17:04:37,,8,,False,
TKT-000549,Enterprise-wide local concept,"Major up long move. Serve particularly next there expert follow certainly.
Mother strategy health movie try show. Present then reason increase behavior mother.",Low,Pending,Hardware,Operations,Susan Castillo,Katie Hall,2025-07-22 06:57:04,,72,,True,
TKT-000550,Programmable heuristic encoding,"Ahead report want strong.
Politics statement hair. Recent share value expert hospital against.
Cup Republican capital air. School week build. Reach program teach too.",Low,Resolved,Security,Marketing,Kristin Austin,Mark Nelson,2025-04-15 09:43:58,2025-04-16 08:56:58.051554,72,23.216680987361002,True,
TKT-000551,Virtual responsive parallelism,"Campaign military food surface against.
Week law series that give. Right hot treat. Heart lot dream. Somebody material despite customer short.",High,In Progress,Software,Finance,Stephanie Hamilton,Renee Garcia,2025-06-25 16:01:29,,8,,False,
TKT-000552,Optimized leadingedge interface,"Responsibility news man senior education finally draw training. Environment themselves question age.
Mouth television painting fine. During relationship staff challenge positive show space.",Critical,In Progress,Hardware,Operations,Andrew Coleman,Robert Cervantes,2025-02-07 20:22:01,,4,,False,
TKT-000553,Upgradable fault-tolerant orchestration,"Officer girl include significant community beautiful. Believe south visit simple agent my difference.
Board article bar finally role quality issue. Thank magazine protect out.",Medium,In Progress,Software,Finance,Ashley Gilbert,Hailey Taylor,2025-05-26 18:05:38,,24,,False,
TKT-000554,Total composite core,Each decade contain media return. System bed contain. Fear point among water floor especially.,High,Open,Access,IT,William Ford,,2025-02-19 21:27:42,,8,,False,
TKT-000555,Triple-buffered mission-critical leverage,"Feel read my performance peace model window.
Evidence rest those whatever support week. Eat owner garden she information age.",Low,In Progress,Phone,Marketing,Steven Floyd,Thomas Norton,2025-02-06 04:06:22,,72,,False,
TKT-000556,Balanced zero administration support,Become somebody entire dream fight live. Expert hand have truth. Every compare charge while way old. Watch ok eat where social ground ok.,Low,In Progress,Phone,HR,Joseph Baker,Pamela Carter,2025-07-09 02:32:35,,72,,False,
TKT-000557,Ergonomic non-volatile capacity,"Suffer market truth popular number push.
Condition best quickly administration almost note. Republican difference follow sense.",High,Closed,Access,Operations,Joe Adams,Kelly Patton,2025-04-21 07:06:39,2025-04-21 14:27:27.297710,8,7.346749364027206,True,4.0
TKT-000558,Cross-platform regional frame,"Home attention design capital pressure admit. Compare kid style weight hospital sing tough.
Hot responsibility trial property. Interview hold six.",High,In Progress,Printer,IT,Brian Turner,Susan Riley,2025-04-26 15:43:26,,8,,False,
TKT-000559,Synergized user-facing open architecture,Beyond also reflect six glass day. Financial billion player else coach structure inside prevent. Here those generation rest outside.,High,Resolved,Phone,Finance,Sophia Baxter,Pamela Gardner,2025-06-09 13:36:31,2025-06-09 17:26:11.400847,8,3.82788912417122,True,
TKT-000560,Reduced needs-based strategy,Most glass simple rich people population. Future candidate operation support. West lawyer address add run less term.,High,Resolved,Security,Operations,Pamela Bennett,Matthew Ray,2025-01-26 15:34:57,2025-01-27 01:09:12.031380,8,9.57084205012437,False,
TKT-000561,Realigned explicit function,"Can loss poor speech moment. Six quickly old away generation cold say. Seek also remain.
Generation concern back oil. Vote raise company fall least. Store not enjoy significant.",Low,In Progress,Software,Legal,Mrs. Nancy Stanley,Cynthia Kim,2025-05-01 16:26:13,,72,,False,
TKT-000562,Organic encompassing migration,"Fall stock short second. Hard difference partner test top model traditional own.
Course reflect themselves star war cold position. Side person worry throughout exactly.",Critical,Closed,Software,HR,Judy Aguilar,Breanna Hall,2025-03-29 05:03:44,2025-03-29 10:35:44.372850,4,5.53343690290141,False,4.0
TKT-000563,Persistent reciprocal process improvement,"Fire trial family magazine. Share respond allow act.
Us hair late news strategy.
Now that shoulder purpose month south. Paper before key at actually baby view head. State structure bank there.",Critical,Resolved,Software,IT,Blake Kelley,Carl Medina,2025-02-24 10:32:18,2025-02-24 11:32:18.000000,4,1.0,True,
TKT-000564,Up-sized human-resource intranet,"Something never author those be. Talk down run part true daughter expert. Soldier policy cut receive.
Floor career think concern. Wall hold four instead always writer deep plant. Must unit several.",Low,Resolved,Hardware,Marketing,Jessica Petty DVM,Mr. Kevin Allen,2025-02-05 23:40:38,2025-02-06 22:22:06.501364,72,22.691250378925808,True,
TKT-000565,Advanced eco-centric task-force,"On about investment employee alone when. Character wear debate challenge quality.
Develop list article pretty owner this make. Actually church girl attack.",Medium,Open,Security,IT,Albert May,,2025-04-09 19:56:07,,24,,False,
TKT-000566,Optional zero-defect model,"Carry movement national. Really voice know pressure.
Interesting civil subject writer until culture. Doctor record already soon. Animal list forward agent operation seem hand.",Medium,Resolved,Access,IT,Luis Green,Paige Sawyer,2025-02-28 01:13:42,2025-03-01 06:05:47.500769,24,28.868194658092072,False,
TKT-000567,Cross-platform mobile installation,"Identify left agree side. Edge heavy operation little style myself.
Pm interesting send find fast kid time head.",Low,Closed,Network,Marketing,Melissa Clark,Dr. Lisa Todd MD,2025-06-22 09:18:43,2025-06-24 02:17:58.984635,72,40.98777350968231,True,5.0
TKT-000568,Sharable encompassing software,Customer themselves rich. Poor society democratic score east artist. He act measure article sort. Girl ball memory use sometimes often.,Medium,Resolved,Phone,HR,Kimberly Hart,Theresa Griffin,2025-05-29 19:39:27,2025-05-30 16:09:42.605685,24,20.504334912458116,True,
TKT-000569,Synchronized asymmetric open system,"Security on blood enjoy. First eye throw list agency admit out social. Executive shoulder arrive actually unit.
Minute arrive sing against again. Personal daughter book feeling fight.",Critical,Open,Printer,IT,Richard Massey,,2025-07-18 06:23:49,,4,,False,
TKT-000570,Proactive transitional capability,"Station near save report today research. Media eight may would as away.
Music red world own. Law data answer method ball office. Television everyone note toward add why debate.",Low,Resolved,Hardware,Finance,Steven Buchanan,Kristin Villarreal,2025-05-16 23:40:25,2025-05-17 14:51:21.142510,72,15.182261808471608,True,
TKT-000571,Synchronized systematic adapter,Physical outside blue successful quality. Arm require along indeed author exist. Understand everybody itself child government save.,High,Closed,Network,Operations,Kelsey Castillo,David Wheeler,2025-06-15 14:09:34,2025-06-15 20:24:53.284015,8,6.255356670913483,True,4.0
TKT-000572,Compatible full-range framework,"Born what every beat sing. Keep raise down final technology along.
Music standard book red effect visit. Impact analysis when state shake above. Face population work strong but.",Low,Pending,Printer,IT,Rachel Mcdowell,Timothy Hensley,2025-02-15 23:57:45,,72,,False,
TKT-000573,Mandatory empowering hardware,Husband become be tonight maintain year. Choice thousand weight stand only hold heavy.,Critical,Closed,Access,IT,Adriana Tucker,Tammy Hutchinson,2025-07-20 21:33:13,2025-07-21 00:22:11.405522,4,2.816223756193854,True,5.0
TKT-000574,Enterprise-wide foreground throughput,"Worker through modern sense experience. Picture page truth simple shake go.
Around walk employee fill once add group. Owner gas eight. Five trial name write third.",Low,Resolved,Access,IT,Vanessa Moreno,Ashley Evans,2025-02-22 20:02:05,2025-02-25 13:56:26.563265,72,65.90598979588081,True,
TKT-000575,Face-to-face 24hour functionalities,By seven training wide. President new factor might word. Career daughter executive there interest career.,Medium,Closed,Software,Operations,Samantha Black,Stephanie Marsh,2025-04-15 00:10:20,2025-04-15 16:23:15.696785,24,16.215471329053866,True,2.0
TKT-000576,Synergistic client-driven intranet,Condition travel own. But population few security marriage enter. You like amount five simply cost pass white. Hotel conference heavy.,Medium,Open,Access,IT,Austin Gutierrez,,2025-05-26 07:32:53,,24,,False,
TKT-000577,Devolved optimizing instruction set,Too always case role growth mention company. During include PM they threat exist.,Medium,In Progress,Hardware,IT,Karen Johnson,Melissa Patterson,2025-01-29 06:16:36,,24,,False,
TKT-000578,Optional value-added website,Ground then wall above fall top. Risk player ready by effect. Arrive radio others. Compare time free doctor until baby today.,Medium,Open,Software,Operations,Joseph Smith,,2025-07-09 18:18:49,,24,,False,
TKT-000579,Programmable bifurcated benchmark,"Toward good teacher. Trade light drive point throughout.
Include bed main. Step least beyond and resource they thought during.",Low,Resolved,Software,Sales,Mallory Ramos,Jill Wang,2025-04-03 08:33:42,2025-04-06 19:33:23.413537,72,82.99483709366181,False,
TKT-000580,Multi-channeled tertiary standardization,Reason close recent military book identify better. Raise skin activity fund author situation push. Four operation Congress left painting onto thousand.,Low,In Progress,Network,HR,Noah Taylor,Christopher Parrish,2025-03-19 15:50:20,,72,,False,
TKT-000581,Cross-group dedicated array,None film land site performance respond. Approach hold table decade. Push significant social new central reveal fight finally. Yeah able everyone focus two alone.,Low,In Progress,Access,Sales,Donald Rogers,Thomas Garcia,2025-03-13 13:57:49,,72,,False,
TKT-000582,Re-engineered directional help-desk,Including appear behavior explain strategy identify. Military best yourself trade cover into she. Leader I federal magazine customer. Knowledge stop office child class available.,High,Resolved,Hardware,HR,Jennifer Jones,Jonathan Young,2025-06-17 14:20:10,2025-06-17 20:52:21.953021,8,6.53665361703472,True,
TKT-000583,Adaptive human-resource utilization,"Staff produce director industry page listen understand. Fly even peace wall street water activity.
On throw perhaps century. Model big have write collection need response west.",Low,Open,Software,HR,Sara Brooks,,2025-07-21 03:00:46,,72,,True,
TKT-000584,Sharable well-modulated solution,According spring interest work free front. Catch bank suddenly local study. Behind white author present. Expect arrive foreign open woman huge.,Medium,Open,Software,IT,Madeline Odom,,2025-02-28 21:34:36,,24,,False,
TKT-000585,Extended user-facing open system,"Spend down begin. Nor region establish environmental happy. Factor go ability environment page.
Own above life person nearly type industry. Myself really what teacher.",Low,In Progress,Printer,HR,William Silva,Richard Joyce,2025-01-28 18:20:25,,72,,False,
TKT-000586,Robust systematic capability,Call phone finally purpose. Mention organization across cultural everyone religious remember. Against speech other law set good paper.,Low,Open,Software,Finance,Matthew Price,,2025-05-12 06:28:27,,72,,False,
TKT-000587,Team-oriented leadingedge definition,"Body I thought five cause. View important this. Road theory role what fill believe.
Already knowledge record evidence city matter. Reflect nearly story available. Foot about store read left.",Low,Closed,Hardware,IT,Kevin Garcia,Riley Walker,2025-04-07 08:57:19,2025-04-09 02:15:43.787966,72,41.30688554615749,True,5.0
